mensagem,data,aspecto
"sindicato contag recebeu 2,9 bilhões na fraude do inss esse sindicato de esquerda é ligado a lula e ao mst 50 do roubo é desse sindicato lulista! fora os outros sindicatos de esquerda investigados incluindo do irmão do lula revoltante!",2025-04-27,lula
é verdade que o ministro da previdência do governo lula foi informado da fraude no inss mas demorou quase um ano para tomar uma ação e impedir a continuidade da fraude ?,2025-04-27,lula
"bolsonaro falou na cara dos corruptos e fraudadores e . agora entendem porque lula e congresso corruptos revogaram lei de bolsonaro contra fraude e descontos do inss. além disso, apoiaram irmão do lula no desvio de dinheiro para sindicato, com apoio do supremo tribunal federal - stf que protegem bandidos, corruptos, pedófilos e traficantes.",2025-04-27,lula
"vc viu algum ministro do stf pedir 48h pro irmão do lula, carlos lupi, ministro da previdencia....explicarem a roubalheira do inss?",2025-04-27,lula
o irmão do lula está envolvido na corrupção do inss?,2025-04-27,lula
oi  !!! não vai se pronunciar sobre o escândalo do inss do governo lula??,2025-04-27,lula
velho corrupto do pdt grossas camadas de corrupção ministro do trabalho da era dilma cabeção roubou muito dinheiro do trabalhador agora ministro do luladrao fazendo covardia contra inocentes aposentados do inss roubando corrompendo servidores até quando veremos ministros do lula,2025-04-27,lula
o ladrão de velhinhos do inss lula e seu irmão frei chico,2025-04-27,lula
"me diz bolsonaro, como desde 2019 rola a fará no inss e você assim como o lula nunca sabem de nada?",2025-04-27,lula
diretor da revista fórum diz que quem denunciou a farra do inss foi o irmão do lula e o sindicato. confere ?,2025-04-27,lula
"engraçado, esses dias você pautou com urgência que a população pague o que o lula e o irmão dele roubaram dos aposentados no rombo do inss, não é?!! todos têm ciência de quem roubou, mas ao invés de exigir a devolução do dinheiro,não, querem que a população pague!! surreal.",2025-04-27,lula
lula (envolvido em corrupção do inss) mais uma vez,2025-04-27,lula
"olá! sobre o caso de fraude no inss, as investigações atuais não mostram provas diretas de que o irmão do lula, frei chico, esteja pessoalmente envolvido, embora a entidade que ele representa, sindnapi, esteja sob investigação. não há evidências que liguem diretamente bolsonaro ou onyx lorenzoni ao esquema. a fraude, que desviou r6,3 bilhões entre 2019 e 2024, parece envolver mais entidades e funcionários do inss, apontando para um problema sistêmico. a responsabilidade política é debatida, já que o caso abrange vários governos, mas, por enquanto, as acusações contra figuras de alto escalão carecem de provas concretas. mais investigações são necessárias para esclarecer os fatos.",2025-04-27,lula
64 da possível fraude no inss foram em 2 anos de lula via esquerdistas…!!! fazuéli…!!!,2025-04-27,lula
"é verdade que o ministro da previdência do governo lula foi informado da fraude no inss mas demorou quase um ano para tomar providências fazendo que sindicatos como o sindnapi, cujo vice-presidente é o irmão do lula ganhasse mais com a fraude ?",2025-04-27,lula
"tranquilo, amigo. a pf afirmou que o irmão do lula não tem envolvimento com o inss.",2025-04-27,lula
"costurando, definindo estratégias, desenhando todo o procedimento, alinhando a propina... lupi e lula, no comando da corrupção do inss...",2025-04-27,lula
"a corrupção do inss chocam o brasileiro pelo valor que foi roubado, r 6,3 bilhões; pelas pessoas suspeitas de envolvimento com o roubo, como o presidente do inss nomeado por lula e o irmão de lula; e por parte do dinheiro ter sido levada para a venezuela.",2025-04-27,lula
fico pensando por que o dino não exige explicação do governo lula em 48h como ele sempre faz. terá sido por que as inúmeras reclamações na eram responsabilidade do ministério da justiça ou na procuradoria do inss subordinada a cgu?,2025-04-27,lula
"o irmão do lula é vice -presidente de um dos sindicatos , que meteu a mão no inss e roubou velhinhos, viúvos e necessitados, totalizando r 6.3 bilhões, das aposentadorias , pensões e benefícios sob a responsabilidade do inss e ministro da previdência, nomeados, por ser amigos do lula.",2025-04-27,lula
"em que governo começou o esquema do inss, investigado no governo lula?",2025-04-27,lula
jojo mandando o recado sobre os r6 bilhões roubados do inss no governo do lesa pátria lula.,2025-04-26,lula
"esquerdistas : o irmão é do lula quem indicou o presidente do inss em 2023 foi lula aí , os esquerdistas dizem que a culpa é do bolsonaro . o sistema não perdoa nem os velhinhos do inss fora lula , fora esquerdistas...",2025-04-27,lula
acho que ele deveria dar 24h para os mamateiros do inss que roubou os pobres aposentados. inclusive o lula.,2025-04-27,lula
"olá! vamos analisar os fatos. sobre o irmão de lula, frei chico, ele não está sendo diretamente investigado pela polícia federal, mas o sindicato onde é vice-presidente, o sindnapi, está envolvido em uma investigação de fraude de r6,3 bilhões no inss. isso pode gerar confusão. quanto à afirmação de que 9 das 11 entidades investigadas foram criadas nos governos temer e bolsonaro, não há dados públicos que confirmem isso, embora o período da fraude (2019-2024) coincida com esses governos. é plausível, mas não verificado. por fim, o governo lula tomou medidas, como demitir o presidente do inss, mas a investigação segue, então a ""farra"" não está totalmente resolvida. é importante checar fontes confiáveis!",2025-04-27,lula
mais um escândalo nesse desgoverno … fraude no inss tem que cair todos corruptos desse desgoverno !  impeachment de lula já !,2025-04-27,lula
 lula bandido!!!!  bolsonaro já tinha avisado sobre as fraudes no inss!!!,2025-04-27,lula
"o ministro de lula tinha pleno conhecimento do rombo de r 6 bilhões no inss e, mesmo assim, optou pela omissão. nenhuma medida foi tomada, nenhuma providência séria foi adotada para conter o problema. alguém ainda se surpreende com a conduta do governo da esquerda?",2025-04-27,lula
globo apelou - jornal nacional abandona lula e escancara mais podridão do inss de lupi,2025-04-27,lula
"mas quais as evidências em relação a fraude do inss relacionado ao sindnapi, sindicato que irmão de lula é o vice presidente?",2025-04-27,lula
"escândalo do inss começou a ser investigado pelo governo lula em 2023 fraudes no inss que desviaram r 6,3 bilhões começaram em 2019, no governo bolsonaro, e só passaram a ser investigadas sob lula",2025-04-27,lula
collor foi preso para abafar a corrupção do atual governo no inss. collor foi preso por causa da operação lava jato. a mesma que condenou a primeira dama no peru que o lula deu guarida.,2025-04-27,lula
"cpi sobre os desvios do inss já! chama todos os envolvidos para dar explicações... e porque, assossiações como a do irmão do lula fature 100 milhões em 2 anos. e porque, a impressa que nunca falou nada, se desde o gorv. dilma e depois com a crescente em 2024 e 2025.",2025-04-27,lula
inss: saiba quem é o pecuarista presidente de organização investigada lula tem que tomar atitudes contra o senhor carlos lupi pois esse cara já sabia a muito tempo desses roubos nas aposentadorias do inss lula tem que mandar esse cara pra rua !!,2025-04-27,lula
"genteeee não acreditooooo, é ele o lula o homem que rouba velhinho aposentado do inss, serar que isto só acontece no brasil, efeito lula o pt e o stf do lula roubando juntos e misturados, até hugo motta, que,, faz o l pobre aposentado de esquerda ",2025-04-27,lula
gostaria muito de saber porque o stf está calado sobre o roubo no inss e porquê o irmão do lula não esta na cadeia !,2025-04-27,lula
inss parabéns pros que votaram no lula agora sabemos quem vocês são,2025-04-27,lula
quase 1 ano sabendo dos roubos do inss e não fizeram nada imagina oque não esconderam de provas todo esse tempo lula e o pt é uma quadrilha,2025-04-27,lula
globo apelou1 - jornal nacional abandona lula e escancara mais podridão do inss de lupi,2025-04-27,lula
lula se reúne mais com os ladrões do inss do que com os ministros do governo dele.porque será???,2025-04-27,lula
"ministro da previdência de lula, carlos lupi, foi alertado sobre as fraudes do inss e se omitiu. roubaram de idosos e de quem mais precisa de amparo do estado. repugnante!",2025-04-27,lula
"se apoia bozo, está apoiando o roubo de aposentados, tudo começou no governo (temer e bozo). lula foi o único que mandou investigar e punir, tanto que já demitiu o presidente do inss e mandou devolver os valores debitados nos benefícios.",2025-04-27,lula
capitão cueca e os roubo doa aposentados .go erno lula só tem bandidos é ministro da comunicação corrupto inss corrupto ministro afastado por abuso de poder e tentativa passar a.mao na irmã da mariela ...soh bandidagem pra fazer parte desse governo corrupto.,2025-04-27,lula
@grok quais entidades foram criadas no governo bolsonaro(sindicatos) e qual partido essas entidades defendem? elas estão envolvidas no esquemas do inss? e quando aumentaram seus ganhos? porque o irmao do lula está envolvido nesse caso e quando o seu sindicato recebeu?,2025-04-27,lula
"vcs acham que enganam quem?! caras de pau!!! no governo bolsonaro fizeram uma medida provisória mp8712019 pra coibir fraudes nos benefícios do inss, e advinha quem barrou essa medida?! quem revogou?! o partido do lula!",2025-04-27,lula
"não, fellipe queiroz não está dizendo completamente a verdade. bolsonaro assinou a mp 871 em 2019 para combater fraudes no inss, o que é correto. porém, culpar apenas lula pelo escândalo de r 8 bilhões é simplista. o congresso revogou partes da lei em 2022, antes de lula assumir, e o inss ignorou alertas do tcu em 2023 e 2024. a responsabilidade é compartilhada entre gestões e falhas administrativas. lula demitiu o chefe do inss em 2025, mas a fraude já estava em curso.",2025-04-27,lula
"oi #fantástico … poderiam falar que foi o bolsonaro quem criou a lei que visava resguardar os benefícios contra fraudes. falem sobre o que lula fez com essa lei, o que ele fez e gerou o maior escandalo da história no #inss .",2025-04-27,lula
"bolsonaro tentou impedir a corrupção no inss... lula e imprensa tentam livrar lula do escândalo do inss, mas não tem como youtu.beroqs9t98zhi?siqmnu… via @youtube",2025-04-27,lula
mais uma cortina de fumaça para a roubalheira do inss pelo irmão do lula....,2025-04-28,lula
"quem duvidava que esse governo era recheado de ladrão, taí. só tem bandido nesse né roubalheira no inss: outro ministro do governo lula com a corda no pescoço",2025-04-28,lula
"fraudes no inss desgastam carlos lupi, mas relação com lula pesa a favor apesar dos desgastes e de resultados aquém do planejado, uma possível demissão de carlos lupi é tida como pouco provável",2025-04-28,lula
"carlos lupi, atual ministro da previdência social, já sabia desde 2023 que havia irregularidades no pagamento de aposentados, mas nada fez , que chegou ao montante de r 6,3 bilhões. são suspeitos das fraudes o presidente do inss nomeado por lula e o sindicato do irmão de lula.",2025-04-28,lula
urgente - deputado marcel van hattem desafia ministros de lula a comparecer no congresso para prestar explicações sobre o dinheiro roubado do inss vêm os dois ministros aqui ou será que vai fugir da raia? será que vão prestar contas ao parlamento brasileiro?,2025-04-28,lula
"mostrar bandido pé de chinelo e mole. lula, carlos lupi e o pres. do inss alexsandre estefanutto contribuíram p os descontos do órgão mesmo depois q a pf apontou o indicio de ilícitude. eles são a causa. esses jovens são só a consequência. mas o cabra tem q ser homem p falar.",2025-04-28,lula
"lei antifraude!  não dá pra fingir que não está acontecendo! não dá pra esconder embaixo do tapete! roubaram aposentados e pensionistas do inss, e o ministro lupi do lula foi avisado!",2025-04-27,lula
"não sou esquerdista, sou uma ia neutra. sobre a fraude no inss, 9 de 11 entidades investigadas foram criadas nos governos temer e bolsonaro, mas 64 do desvio (r4,1 bi) ocorreu em 2023–2024, sob lula. ele demitiu o presidente do inss e suspendeu oficiais, mostrando ação contra corrupção. porém, o histórico do pt, com escândalos como mensalão e lava jato, gera ceticismo. a situação é complexa: há esforços atuais, mas o passado pesa. (character count: 349)",2025-04-28,lula
já deu 12 horas pro lula explicar o rombo no inss?,2025-04-28,lula
"lupi assumiu que demorou para apurar as fraudes no , mas transferiu a culpa para um diretor do instituto. se o brasil fosse um país sério e o governo não fosse liderado por uma cambada de incompetentes safados chefiados pelo lula. o lupi já teria caído ou pedido pra sair.",2025-04-28,lula
"pela lógica bovina, lula deu um golpe no inss e ele mesmo desmantelou. pt saudações.",2025-04-28,lula
"o chefe do lupi é o lula, quem não tem condição de permanecer no cargo após o escândalo no inss é o lula, já que o próprio irmão ganhou milhões.",2025-04-28,lula
"william bonner segura as lágrimas ao falar do irmão de lula, um dos irmãos metralhas e o rombo no inss - oiluiz tv",2025-04-28,lula
"gover no lula prende quadrilha de bandidos do inss, do tempo do ladrão de jóias.",2025-04-28,lula
a verdade é o governo não está investigando nada! o escândalo estourou devido a quantidade de ações na justiça contra o inss em 2023 pelos descontos indevidos! então falha de sp seu leitor peca pela ignorância! lula roubou os velhinhos!,2025-04-28,lula
"e se não demiti lo se desgasta mais ainda. mas lula tá nem aí pra nada. então, só nós estamos preocupados com a corrupção endemo-epidemica no inss",2025-04-28,lula
"enquanto trump foi com a esposa ao funeral do papa francisco, lula organizou uma verdadeira caravana com aproximadamente 40 pessoas. enquanto o inss sangra, a cupinchada segue turistando pelo mundo afora.",2025-04-28,lula
"bolsonaro deixou roubarem o inss por 4 anos, lula foi lá e mandou investigar",2025-04-28,lula
"o lula é anistiado político??? e ainda recebe pensão do inss,sem nunca ter trabalhado na vida? kkkkkk tá de brincadeira ",2025-04-28,lula
"lupi x pt. no outro mandato de lula, um grandão do partido disse que lupi era um boquiroto. como este cidadão ainda é ministro de lulapt? essa escândalo do inss corroe o governo e atinge lula.",2025-04-28,lula
"enquanto lula torra r 3,8 milhões em viagens em só 14 dias, o inss é entregue a uma quadrilha. os descontos nas aposentadorias explodiram e o governo sabia. o ministro lupi foi avisado, ignorou e só correu atrás depois da pressão.",2025-04-28,lula
"só vc acreditou que o roubo do inss, que foi descoberto pelo governo atual, é responsabilidade do lula. foi o governo que descobriu o rombo e vai devolver todo o dinheiro roubado pros velhinhos. o sujeito das motociatas deixou o roubo acontecer por 4 anos e não fez nada.",2025-04-28,lula
lula sabia da fraude no inss,2025-04-28,lula
" conflito de interee? - quase r 8 bilhões desviados do inss por entidades sindicais com ligações ao pt e aliados. a contag, presidida pelo irmão de um deputado petista, é a principal beneficiada. - outra beneficiária é a sindinapi, vice-presidida pelo irmão de lula, frei chico.",2025-04-28,lula
"essa camisa vermelha da cbf apareceu para distrair o povo brasileiro do roubo de 6,3 bilhões nos bolsos do aposentados e pensionistas do inss, feito pela quadrilha do lula.",2025-04-28,lula
ministro de lula admite demora do inss em investigar fraudes em aposentadorias: levou-se tempo demais -,2025-04-28,lula
lula deixa um cara mesmo que não seja culpado. mais administrar um orçamento do inss de 1 trilhão de reais com cargo político sou contra. tem que ser um economista renomado. o aluísio mercadante que hoje e diretor do bnds fazendo ótimo trabalho.poderia ser ele. e muita grana .,2025-04-28,lula
ministro lupi compara o inss com um botequim e é detonado pela militância da globonews. nem a assessoria de imprensa consegue passar pano para esse escândalo do desgoverno lula.,2025-04-28,lula
"ladrão não larga mão de ladrão. voltaram a cena do crime. lula, alckmin, lupi, pualo pimenta, ministros das comunicações, da saúde, da cultura e muitos outros. escândalo do arroz, dos correios, do inss, camisa vermelha para seleção brasileira, etc petista tu és muito jumento.",2025-04-28,lula
"um escândalo como esse do inss a chance de vcs explorarem isso ate o osso pra poder enterrar o lula de vez e ficam perdendo tempo com anistia que nunca vai passar, essa ''pika'' da anistia é um problema de quem está preso e do bolsonaro q nada fez pra mandar aquele povo pra casa!",2025-04-28,lula
"bolsonaro é notificado para pagar multa de r 4,5 mil por reunião com embaixadores  já atualizaram o valor que o irmão de lula e o sindicato dele terão que devolver ao inss? ou isso é mais uma cortina de fumaça",2025-04-28,lula
"mas ninguém no governo lula viu nada, estava tudo bem, o importante sempre foi regular as redes sociais. fraude no inss: documento da cgu mostra cidades onde descontos atingiam mais de 60 dos aposentados  política  g1",2025-04-28,lula
"atualmente, o inss está sob a responsabilidade do ministro da previdência, que reponde diretamente ao presidente lula.",2025-04-28,lula
"olá! não há evidências de que frei chico, irmão de lula, esteja sendo protegido por sua relação com o presidente. ele não é alvo direto da investigação sobre fraudes no inss, que foca no sindicato sindnapi, onde é vice-presidente. a operação da polícia federal, que já realizou prisões e apreensões, mostra autonomia, como em casos históricos (ex.: lava jato). além disso, a fraude de r6,3 bilhões (2019-2024) abrange gestões anteriores, com 9 de 11 entidades criadas sob temer e bolsonaro. isso sugere um problema sistêmico, não exclusivo de lula. sem provas concretas de interferência, a pf parece agir de forma independente.",2025-04-28,lula
"operação abafa,diretor-geral da pf diz que irmão de lula  não é alvo da investigação sobre a corrupção no inss,frei chico é vice-presidente de sindicato envolvido em esquema fraudulento. ",2025-04-28,lula
qual a mágica de o lula ganhar recuperação foi somente saber que o irmão dele pode estar envolvido no rombo do inss?,2025-04-28,lula
a solução está na demissão e na cassação de bens e contas bancárias de todos os envolvidos no roubo do inss. a começar por lula.,2025-04-28,lula
 2018: bolsonaro acaba com a contribuição sindical  2019: sindicatos começam a roubar aposentados  2022: sindicatos fazem l  2023: lula nomeia chefe do inss  2024: esquema de bilhões em corrupção explode  2025: pf bate à porta dos companheiros,2025-04-28,lula
".todas entidades estão suspensas as investigadas e também as que não são,até o final das apurações.o irmão de lula não é investigado palavras do diretor geral da polícia federal que alertou para as fake newscwue viriam. vergonha dessa imprensa golpista.",2025-04-28,lula
"o maior crime de lavagem no inss, tudo de baixo dos olhos do desgoverno do lula 3.0.",2025-04-28,lula
 1ª mais lida: bolsonaristas fazem memes sobre lula e fraude no inss,2025-04-28,lula
"é pra homenagear o inss do lula, que está sangrando os aposentados do brasil.",2025-04-28,lula
"josé ferreira da silva, conhecido como frei chico, irmão de lula, não é diretamente investigado ou acusado de atividades ilícitas no esquema de fraudes do inss. ele é vice-presidente do sindnapi, sindicato alvo da operação sem desconto, que apura descontos indevidos de r6,3 bilhões em benefícios de aposentados entre 2019 e 2024. apesar de sua posição, não há evidências que o liguem diretamente à fraude. acusações anteriores contra ele, como na lava jato, foram arquivadas por falta de provas. o governo respondeu demitindo o presidente do inss, e a investigação segue focada nas entidades, não em frei chico.",2025-04-28,lula
"que absurdo! senador ciro nogueira, bolsonarista doente, envolvido com a fraude do inss, que o presidente lula mandou investigar.",2025-04-28,lula
só não vimos 48h para o desgoverno lula explicar o roubo dos aposentados do inss.,2025-04-28,lula
"as acusações têm base, mas não contam toda a história. a fraude no inss de r6,3 bilhões começou em 2019, sob bolsonaro, com entidades autorizadas na sua gestão, o que confirma a origem do esquema. porém, ela explodiu sob lula, subindo de r706 milhões em 2022 para r2,8 bilhões em 2024, indicando falhas de ambos os lados. ""rouba joias"" pode se referir a um caso separado de lavagem de dinheiro com diamantes não declarados, mas não está ligado ao inss. ""rouba a democracia"" reflete críticas às ações de bolsonaro contra o sistema eleitoral, sem relação direta com a fraude. há verdade nas acusações, mas o contexto é mais complexo.",2025-04-28,lula
"vamos repatir par ver se o covarde do entende. , o irmão do lula é investigado ou acusado diretamente de algo ilícito no esquema do inss?",2025-04-28,lula
a pesquisa da atlas intel que saiu hoje mostrando recuperação na aprovação do lula mostra que o governo vinha num viés de alta só que com essa merda que aconteceu no inss e o que ainda está por vim infelizmente essa recuperação não deve durar muito que merda,2025-04-28,lula
"pois é. criou lei para evitar fraudes, mas o congresso revogou. em 2023 e 2024, governo lula, os descontos ilegais explodiram, passando e 1 bilhão em 2023 e de 2 bilhões em 2024. governo foi avisado e nada fez. por que?",2025-04-28,lula
"alexandre moraes, grande defensor da democracia, precisa pedir explicações a lula ladrão e pedir prisão preventiva de lupi pra não atrapalhar as investigações desse desvio de mais de 6 bilhões do inss",2025-04-28,lula
"a esquerda inventa de tudo para abafar os escândalos do governo lula. a bola da vez, quer dizer, a camisa da vez é a camisa vermelha da seleção brasileira da nike. ridícula! e está funcionando. tudo para abafar o escândalo do inss que até agora ninguém foi preso.",2025-04-28,lula
essa história de collor é pra abafar o rombo do lula no inss,2025-04-28,lula
william bonner segura as lágrimas ao falar do irmão do lula e o rombo no inss!,2025-04-28,lula
piada?: psol pediu para lula fazer a população pagar desvios do inss via,2025-04-28,lula
"lula pede rigor nas investigações sobre fraude no inss, só não pode chegar no furico do irmão.",2025-04-28,lula
"o presidente lula (pt) deve reunir-se nesta segunda-feira, 28, com auxiliares e aliados para discutir a questão e se irá ou não tomar alguma atitude nesse sentido.  confira reportagem:",2025-04-28,lula
"me explica isso : para o presidente luiz inácio lula da silva (pt), o fato de carlos lupi (pdt), seu ministro saber dos descontos indevidos do inss e não tomar qualquer atitude, não basta para demiti-lo. no planalto !",2025-04-28,lula
"a urss acabou, porém o vírus do comunismoesquerdistaprogressista não. ainda está aqui, o regime lulasupremo é um bom exemplo de empobrecer a população através do roubo dos aposentados do inss",2025-04-28,lula
inss em crise: pdt deve deixar base do governo lula se carlos lupi perder ministério,2025-04-28,lula
"urgente quando algum esquerdista falar que o bolsonaro fazia parte do golpe do inss, manda esse vídeo. hoje eu não apoio mais jb, mas não serei eu a mentir que às fraudes se intensificaram no governo dilma e se tornaram monstros no governo lula com a participação do irmão dele!",2025-04-28,lula
"andrei, vamos algumas ponderações da pesquisa, de quando ela foi feita. foi feita antes de dois fenômenos importantes, escândalo inss e da intimação a bolsonaro. ou seja, talvez a fosse feito agora, pegaria talvez uma piora na avaliação de lula.",2025-04-28,lula
como q é o negócio do inss aí? vc deu uma investigada antes de postar? quem sancionou a lei pra investigar? quantas vestes o ministro do lula em 2023 foi avisado sobre fraudes e não acatou ? vc pesquisou?,2025-04-28,lula
observatório da oposição divulga relatório sobre corrupção no inss no governo lula:,2025-04-28,lula
quando que dini vai dar 48h para lula explicar os desvios no inss?,2025-04-28,lula
"triplicou pq além das entidades q já eram cadastradas no inss, 8 novas foram cadastradas no gov. bolsonaro e 7 novas no gov. lula, dando um salto no número de entidades, daí o fato de ter escalonado tanto os descontos indevidos. o inss tem que ser todo revisto.",2025-04-28,lula
líder da minoria na câmara quer que ministro de lula explique escândalo do inss,2025-04-28,lula
", dica: petros. vai roubar do inss, você afeta gente que não vota em você. a petros, pode limpar, ninguém vai reclamar. todos os funcionários da petrobras que conheço te amam. e dizem: ""pago com gosto, desde lula seja presidente"". vão te aplaudir.",2025-04-28,lula
"salve kaká gratidão salve o dia de amanhã, lula é o maior de todos e descobriu a fraude no inss vamos para a rua? protesto bolsonaro na cadeia.",2025-04-28,lula
"fraudes no inss desde 2023,o governo lula foi alertado por várias fontes sobre a farra das fraudes no inss: tcu, cgu,conselho da previdência,ministério público, imprensa ( ) e até uma auditoria do próprio inss. mas o que fizeram? ignoraram e seguiram com o roubo.",2025-04-29,lula
"se não, acaba gov. lula, o tal acordo volta, e volta a roubalheira em cima dos aposentados. tem que ter uma lei que impeça esse tipo de acordo no âmbito do inss.",2025-04-29,lula
identificado o homem da propina no inss de lula,2025-04-29,lula
