mensagem,data,aspecto
"a notícia é em grande parte verdadeira. a operação sem desconto de 2025 revelou fraudes de r 6,3 bilhões no inss, com descontos indevidos de 2019 a 2024. o sindicato sindnapi, onde frei chico, irmão de lula, é vice-presidente, foi alvo, mas não há evidências de que ele esteja diretamente envolvido. a linha do tempo do post, incluindo o fim das contribuições sindicais em 2018 e a nomeação do chefe do inss em 2023, está correta. porém, alegações de que lula ou frei chico orquestraram a corrupção não têm provas claras. o sindicato diz apoiar a investigação. cautela é necessária, pois o tema é politizado.",2025-04-24,lula
resumão: márcio thomaz bastos era ministro da justiça quando corrupção no inss começou fraude no inss começou no governo lula a fraude do inss começou a ser investigado em 2003 no governo lula esquerdistas e gado de políticos não vão pesquisar!,2025-04-24,lula
"frei chico, irmão de lula, é vice-presidente do sindnapi desde 2024, mas membro desde 2008. o sindicato é investigado por fraudes no inss de r 6,3 bilhões, mas não há evidências diretas contra ele. não foi alvo inicial da pf, e sua inocência não está provada nem refutada. a investigação continua.",2025-04-24,lula
os abutres da extrema direita faz as falcatruas no inss e depois a culpa é de lula  lula contra corrupção,2025-04-24,lula
e os 6 bilhões do inss e o irmão do lula? vai xandão neles ou não?,2025-04-24,lula
"mas fala aí. a corrupção do inss começou no governo bolsonaro em 2019 e em 2023 começou a ser combatida, em pleno governo lula. ou és mais um bolsonarista que não sabe ler?",2025-04-24,lula
lembrando que irmão de lula está sendo investigado pela fraude do inss,2025-04-24,lula
acorda os políticos da direita estão enchendo a rede social de informações que o lula e o irmão dele são os responsáveis pela fraude do inss.,2025-04-24,lula
"precisou que entrássemos no terceiro ano do governo para entendermos essa foto, o lula subiu na rampa pra roubar a terra do índio e vender para ongs e europeus, o inss dos velhos e deficientes e os cães para representar o futuro impostos dos pais e mães de pet.",2025-04-24,lula
lula decidiu - com uma forcinha de casos que envolve a família dele - a ser o novo lançador de fumaça para tentar abafar o caso do roubo no inss e o caso dos venezuelanos.,2025-04-24,lula
venham ver o que alckimin e lula fizeram depois do fhc. venham investigar o sp-prev. meu contrato é de 1974 e contribuo até hoje com a previdência. é um assalto do governo contra nós prof. universitários. contribuo há 50 anos. não é inss. é sp-prev. sou concursada e estatutária.,2025-04-24,lula
quem nomeou o responsável pelo inss durante essa fraude bilionária? a nomeação partiu de alguém indicado pelo lula?,2025-04-24,lula
bia esta chegando aqui pra mim através de bolsonarista do envolvimento do irmão do lula nesse assunto do inss. vice tá sabendo dessa história?,2025-04-24,lula
"no meu entender , esses eleitores de lula tb são vítimas , se quiser ajudá-la diz para acessar o app meu inss e procurar no extrato por descontos estranhos com nomes de entidades que ela não autorizou. e também diz para votar melhor em 2026.",2025-04-24,lula
"mas o presidente do inss foi indicado por quem? depois de três anos de desgoverno lula, a pf decidiu agir. porque estava ocupada prendendo gente inocente a mando dos urubus do stf.",2025-04-24,lula
"a corrupção no inss começou no governo bolsonaro e durou todo seu mandato. agora com um governo de verdade, que não interfere na pf, foi possível investigar e derrubar essa fraude. lula contra a corrupção",2025-04-24,lula
"e os escândalos de corrupção se acumulam, com a gestão do pt: mensalão (governo lula) desvio de r 141 milhões (fonte: jornal o sul) petrolão (governo dilma, poste do lula) desvio de r 6 bilhões (fonte: jornal o sul) descontão (governo lula) desvio de r 6,3 bilhões do inss",2025-04-24,lula
governo lula não desmontou nada. a polícia federal que depois de três anos de administração do desgoverno lula no inss descobriu o esquema de ladroagem. lula tem espertise em corrupção.,2025-04-24,lula
 4ª mais lida: sindicato ligado a irmão de lula é alvo da operação que mira o inss,2025-04-24,lula
"irmão do lula envolvido em esquema de corrupção no inss.... a culpa é de quem?? bolsonaro, claro!!!!",2025-04-24,lula
o roubo nas aposentadorias dos velhinhos do inss disparou depois que o governo lulapt assumiu.,2025-04-24,lula
"vc espalha desinformação. estamos em 2025. o presidente do inss foi demitido em 23042025. ou seja, a fraude continuou por quase td o governo lula. fonte:",2025-04-24,lula
o irmão dele está envolvido no escândalo do inss então o lula está enviando também,2025-04-24,lula
e o lula ainda vai sair por cima como quem salvou o inss. esse país n tem jeito,2025-04-24,lula
"lula o seu governo foi só lacração, nada fez pelo povo. virou papagaio do hamas, escândalo do inss e manteve o orçamento secreto. vc é uma mentira! uma vergonha moral e humana!",2025-04-24,lula
miados news rp - fraude do inss vai derrubar lula,2025-04-24,lula
o lula poderia sacar o seu dinheiro escondido no banco do vaticano para cobrir o rombo do inss,2025-04-24,lula
"lula usando o irmão de laranja para roubar 6,3 bilhões do inss, mas o importante é que tiramos o ""bozo"".",2025-04-24,lula
irmão de luiz inácio lula da silva está no esquema da roubalheira no inss.,2025-04-24,lula
"mentira , o golpe começou em 2023 quando lula nomeou stefunatto para a presidência do inss por indicação de carlos lupi , ministro da previdência de lula ! o irmão do lula também está envolvido na roubalheira ! eita família …",2025-04-24,lula
disseram que o janones ladrão está revoltado porque não conseguiu tirar o dele no roubo do inss quando até o irmão do ladrãode 9 dedos tirou? fontes revelaram que o rachadones deu crise de choro por não ter embolsado nada dos 6 bilhões roubados por aliados do lula. ,2025-04-24,lula
"meteu essa? kkkkkkkkkkkkkkkkkkkk sindicalista, inclusive um que o irmão do próprio lula faz parte, fraudando o inss pra roubar o aposentado e mete essa que é ""cuidar dos pobres é roubar"". bizarro. e tem gente que cai nessa conversa.",2025-04-24,lula
2 indicados de lula passaram por la. sabe se do rpubo desde 2024. seu lambe bita,2025-04-24,lula
"mulé, vai cuidar a aposentadoria do inss ta tua mae q ta sendo roubada pelo lula!",2025-04-24,lula
"só depois da posse de lula, com a cgu e a pf de volta ao jogo, é que começaram a cavar fundo nas fraudes do inss — aquelas mesmas que começaram lá atrás, em 2019, no governo bolsonaro e ficaram debaixo do tapete até 2023.",2025-04-24,lula
"foi pego com a mãe na botija! desmascarado pela pf e teve que demitir o presidente do inss que foi nomeado e escolha pessoal do dele (lula). pt é sinômino de corrupção, foi assim no mensalão, petrolão e agora inss",2025-04-24,lula
"vai afetar reputação de lula?? aonde, o cara te um passado só de corrupção e corruptor. até o irmão tá envolvido nesse desvio do inss. contem outra por favor, isso chega a ser ridículo falar de reputação de um criminoso, bandido e ladrão.",2025-04-24,lula
"lula determina demissão do presidente do inss alessandro stefanutto é um dos alvos de operação contra desvio de r 6,3 bilhões",2025-04-24,lula
(minha análise)- r 6 bilhões desviados do inss no governo lula.  o cuidar dos pobres virou roubar dos pobres. vergonha!,2025-04-24,lula
"avisem à deputada que o brasil tem, no momento, mil coisas mais importantes para tratar. o brasil pegando fogo devido à corrupção do inss e lula invertendo a ordem das prioridades.",2025-04-24,lula
"o problema não é só ""na cabeça"". a fraude no inss de r 6,3 bilhões começou em 2019 (bolsonaro) e seguiu até 2024 (lula). associações e sindicatos descontaram sem autorização, mas a operação ""sem desconto"" de 2025, sob lula, revelou o esquema e afastou o presidente do inss. ambos os lados têm culpa por não detectarem antes. ódio não resolve, mas ignorar fatos também não. ",2025-04-24,lula
e pq o ministro do lula tá defendendo o presidente do inss indicado por ele? pq o sindicato do irmão do lula tá sendo investigado? pq o lula não demite o lupi? tem que ser muito gado pra cair nesse golpe.,2025-04-24,lula
nível lava jato: oposição reage com indignação à operação sobre desvio de r 6 bilhões do inss sob governo lula,2025-04-24,lula
e o inss vão começar a falar quando da corrupção do governo lula? vão esperar feder a merda mesmo? kkkkkk o irmão do lula ta impaciente ja se vai ou não ser preso.,2025-04-24,lula
"já vai faltar dinheiro pra serviços básicos em 2027. estatais dando prejuízo, bandidos confessos sendo libertados, dívida pública recorde, inflação e agora roubo do inss. o governo lula é isso aí, sempre rodeado do pior tipo de gente, mas ele ""nunca sabe de nada""kkkk",2025-04-24,lula
"o atual presidente do inss, alessandro stefanutto, foi nomeado em julho de 2023 pelo presidente luiz inácio lula da silva, por indicação do ministro da previdência social, carlos lupi. ele foi afastado em 23 de abril de 2025 devido à operação sem desconto, que investigou fraudes iniciadas em 2019.",2025-04-24,lula
governo lula você faz parte do governo que roubou 6 bilhões do inss,2025-04-24,lula
urgente! policia federal pega irmão de lula no roubo do inss e daniela l... via,2025-04-24,lula
sem fakenews. lula acabando com a farra do inss iniciada no governo bolsonaro em 2019,2025-04-24,lula
"a fraude no inss, estimada em r6,3 bilhões de 2019 a 2024, envolveu deduções não autorizadas de benefícios de aposentados. a operação ""sem desconto"" resultou em prisões e apreensão de mais de r1 bilhão. frei chico, irmão de lula, é vice-presidente de um sindicato investigado, mas não é acusado. não há evidências de envolvimento do filho de lula. a investigação foca em questões sistêmicas, não em indivíduos, apesar de debates políticos. o governo agiu, demitindo o presidente do inss e suspendendo servidores, visando transparência. (349 caracteres)",2025-04-24,lula
o verdadeiro ladrão é lula que indicou o presidente e o irmão para roubarem os idosos no inss.,2025-04-24,lula
"viva o lula, gritou o alckmin. viva o sus, gritaram os artistas. viva o inss, agora gritam os sindicalistas. e o povo grita, grita nada, ô povinho cordeirinho.",2025-04-24,lula
a amante do lula ladrao tambem saqueou o inss.,2025-04-24,lula
"as investigações do escândalo do inss começaram em 2023, no governo lula, não no de bolsonaro. a fraude, com descontos indevidos de r 6,3 bilhões, iniciou em 2019, durante o governo bolsonaro, mas só foi investigada formalmente após sua gestão. em 2024, a pf abriu 12 inquéritos, culminando na operação de abril de 2025, com prisões e afastamento do presidente do inss.",2025-04-24,lula
" não caia em fake news  esquema de corrupção no inss atravessou o governo de bolsonaro, sem nenhuma investigação, de 2019 a 2022  em 2023, já no governo do presidente lula, a cgu pediu pra pf investigar em sigilo  foi deflagrada a operação sem desconto",2025-04-24,lula
"o cara estava no inss desde 2011 , governo dilma rousseff, como foi o bolsonaro que colocou ele lá? seja homem janones e responsabilize o lula , porque você age como maricas .",2025-04-24,lula
"tá aí você que vai pagar, lula o inss ? ou povo brasileiro que paga",2025-04-24,lula
"ainda sobre o inss do governo lula ""mas o esquema foi mantido."" quer dizer que se tivessem roubado só até 2023 o tcu não iria denunciar, verificar, investigar? até 2023 estaria liberado o roubo? como é bom ter amigos assim!",2025-04-24,lula
"se investigarem direitinho vão acabar descobrindo que o grande beneficiário do nosso já falido inss é o narcoditador maduro, amigo do peito do corrupto lula.",2025-04-24,lula
governo lula já criou grupo de trabalho para recuperar dinheiro das vítimas de fraude no inss! lula contra corrupção,2025-04-24,lula
a turma de vagabundos que querem o bolsonaro na cadeia são os mesmos vagabundos que estão passando pano para a fraude milionária do inss que teve a participação do irmão do ladrão do lula.,2025-04-24,lula
" combate a facções criminosas pqp, vc é um fdp cara de pau, olha aí o caso do inss, irmão do maior corrupto da história brasileira ""lula"" tem envolvimento... e vcs não falam nada.... bico ",2025-04-24,lula
"o irmão do lula está envolvido no escândalo do inss e dos sindicatos. qual é o papel dele na fraude, vc sabe?",2025-04-24,lula
lula contra corrupção,2025-04-24,lula
"o lula não deveria ter mandado investigar, ele fodeu o ministro dele, o presidente do inss que ele nomeou e o pior vai colocar o próprio irmão na cadeia, todos do governo lula. o bolsonaro vai sair ileso dessa, porque será ? kkkk vc é um psicopata.",2025-04-24,lula
quem nomeou o presidente do inss e qual o cargo do irmão do lula e envolvimento no inss? coincidência? eu não acho.,2025-04-24,lula
"e sem contar que depois que o lula assumiu,a fraude no inss disparou , inclusive,um de seus irmãos é suspeito de envolvimento na fraude do inss",2025-04-24,lula
qual foi o mal que bolsonaro fez pra tanta gente o que fizeram com ele deram uma facada até hoje ele ta sofrendo ele foi o melhor presidente que o brasil já teve só não ver quem não quer ver o rumo que o brasil ta indo com lula assalto nos correios no inss!,2025-04-24,lula
precisaram lançar uma bomba ninja para esconder o envolvimento do irmão do lula no escândalo do inss. o governo mais corrupto da história mundial...,2025-04-24,lula
"ela assusta com 30mi da coleguinha do lula, eles acabaram de roubar 6.2bi do inss kkk",2025-04-24,lula
"inss foi descoberto mais uma vez bo governo do lula, como o bolsonaro não descobriu durante seu mandato?",2025-04-24,lula
"inss - entidades envolvidas no esquema de fraude: sindicatos e associações de aposentados - o esquema passou por por temer e bolsonaro, sem investigação - as investigações da pf e agu começaram em 2023 foi preciso lula voltar para desvendar o esquema! lula contra corrupção",2025-04-24,lula
será que assalto aos velhinhos do inss causa tanta indignação ao lula e à deputada?,2025-04-24,lula
"contra o que, homem? lula é maior canalha, traidor, meteu zanin e dino no stf orientados para reverter a situação revisão da vida toda do inss, lula da esmola do bolsa família para ganhar votos, mas quem paga são os trabalhadores. hobin woody invertido, tira dos pobres.",2025-04-24,lula
"a impressão de que o título da matéria minimiza o caso pode surgir, pois sugere que apenas bolsonaristas criticaram lula, ignorando a preocupação ampla com a fraude de r6.3 bilhões no inss. o esquema começou em 2019, sob bolsonaro, mas cresceu em 2023–2024, durante lula. a cgu e a pf, sob lula, agiram em 2025, com prisões e demissões, mas a persistência da fraude levanta críticas gerais, não só de um grupo político.",2025-04-24,lula
"se a gente não compartilhar a verdade, as fakenews vão ganhar mais uma vez. foi o bolson4zi que desmantelou o inss, querendo colocar milico lá dentro, pra roubar ainda mais. a quadrilha quem montou foi ele. o governo lula parou com a farra!",2025-04-24,lula
"lula contra a corrupção ja foi juscelino ministro das comunicações agora o ministro do inss .. nao acabara ai,,, veremos mais corruptos e corruptores",2025-04-24,lula
"cristina tem que precionar todo o congresso após descobrirem a lista que compõem todos os golpistas do inss e ( provavelmente ) a certidão de cremação do verdadeiro lula datada de 2022 escondida dentro da parede da casa do lulinha, entenda porque a invasão da uti.",2025-04-24,lula
em 2022 lula mandou investigar os desvios no inss?,2025-04-24,lula
"não, o montante desviado no esquema do inss, estimado em r 6,3 bilhões, não pode ser totalmente atribuído aos governos anteriores. a fraude ocorreu entre 2019 e 2024, abrangendo os governos bolsonaro (2019-2022) e lula (2023-2024). embora tenha começado sob bolsonaro, continuou durante o governo lula, o que torna impreciso culpar apenas os governos passados. a administração lula descobriu a fraude em 2025 com a operação sem desconto, mas a continuidade até 2024 sugere falhas de fiscalização. a responsabilidade é compartilhada, sem dados exatos para dividir o montante por governo.",2025-04-24,lula
"não, bolsonaro não colocou o irmão de lula, frei chico, no sindicato. frei chico é vice-presidente do sindnapi desde 2008, bem antes de bolsonaro assumir. a fraude no inss começou em 2016 e escalou entre 2019 e 2022, durante o governo bolsonaro, totalizando r 6,3 bilhões. embora o sindnapi esteja sob investigação, frei chico não foi alvo de mandados de prisão e defende uma apuração completa. o governo lula, desde 2023, agiu ao demitir o presidente do inss e suspender as entidades envolvidas, como parte da operação ""sem desconto"" de 2025. a responsabilidade não pode ser atribuída só a lula, já que o esquema começou antes.",2025-04-24,lula
"as fraudes triplicaram no governo lula e ele não fez nada até agora, enquanto o sindicato do irmão dele enchia as burras. além disso, roubar inss é tradição do pt.",2025-04-24,lula
"mano, quem roubou o inss é parte do sistema atual. correios falidos pelo sistema atual. estatais dando prejuízo pelo sistema atual. inflação comendo nosso dinheiro disparando no sistema atual. eu quase perdi a conta xingando o bolsonaro. você critica essa carniça de lula?",2025-04-24,lula
"alessandro stefanutto, presidente do inss durante a fraude de r 6,3 bilhões, foi nomeado em julho de 2023 pelo governo lula, sob indicação do ministro carlos lupi. a fraude, porém, ocorreu entre 2019 e 2024, começando no governo bolsonaro e continuando no governo lula. stefanutto foi demitido por lula em 23 de abril de 2025, após a operação sem desconto da pf.",2025-04-24,lula
oportunista barato. responde o que acontecerá com o presidente do inss do bolsonaro e com o próprio bolsonaro sobre os desvios??? lembrando que só fomos descobrir porque o governo lula deixa a policia federal trabalhar.,2025-04-24,lula
"isso deve ficar claro, que a corrupção do inss, começou no primeiro ano do governo bolsonaro, com possível envolvimento de gente do inss, e pf e cgu e lula descobriram tudo e estão punindo todos.. parabéns",2025-04-24,lula
que isso vem desde 2019 então se ela tivesse votado no lula ou no bolsonaro a fraude do inss estava a todo vapor. repito a todos desconfie das informações quando vem de pessoas com lado político bem definido.,2025-04-24,lula
motta não poderia estar mais enganado. o povo está vendo o stf prender velhinhas e soltar traficantes. atacar bolsonaro enquanto o irmão do lula saqueia o inss dos aposentados. com conivência dessa mídia podre. o brasileiro de bem vai dar o troco a cada eleição.,2025-04-24,lula
"a fraude no inss começou em 2019, no governo bolsonaro, e continuou até 2024. não há evidência de que lula mandou encerrar investigações; pelo contrário, sua gestão iniciou apurações em 2023, com grande operação em 2025, afastando o presidente do inss e prendendo suspeitos. o esquema de 6,3 bilhões é um problema sistêmico, não de um governo só.",2025-04-24,lula
quem criou o inss não foi lula nem alckmin. acho que você está confundindo as coisas. estamos falando da fraude que começou no governo bolsonaro.,2025-04-23,lula
"conversa fiada! todos vimos que foram trocados 3 diretores do inss na gestão honesta do bolsonaro. e lula nomeou este atual diretor, que, muito estranho, não ter ciência da corrupção",2025-04-24,lula
você escreveu uma mentira: bolsonaro não nomeou esse stefanuto como presidente do inss. ele foi indicado pelo lupi e nomeado pelo lula em 2023.,2025-04-24,lula
"a roubalheira no desgoverno lula foi de 5,4 bilhão ao inss , de 2016 a 2022 foi 600 milhões e bolsonaro pediu investigação ,99 do roubo foi da esquerda",2025-04-24,lula
"concordo plenamente bolsonaro não fez nada tal como lula,é caso diga 2019 léia começou em 2016.",2025-04-24,lula
"caro alienado, o lula tem histórico e detalhe irmão dele envolvido no esquema e pau no cu do bolsonaro também, brasileiro é muito burro dão um jeito de querer defender o indefensável os cara estão é nos roubando foram 6bi desviados do inss agora imagines em outras áreas",2025-04-24,lula
"as fraudes no inss começaram em 2019, quando jair bolsonaro era presidente. o esquema, com descontos indevidos de r 6,3 bilhões, continuou até 2024. investigações começaram em 2023, e a operação sem desconto, em abril de 2025, ocorreu sob luiz inácio lula da silva. sua vizinha pode verificar descontos no app meu inss, acessando ""extrato de benefício"". se houver irregularidades, ela pode excluir a mensalidade pelo app ou ligar no 135. para reembolso, contate a associação pelo 0800 no contracheque.",2025-04-24,lula
"o brasil está avesso: lula ainda sairá como herói em relação ao escândalo do inss. também caso aconteça a anistia, ele levará os créditos e se reelegerá fácil. o povo é massa fácil de manobra. qualquer trocado garante o voto. lula 4 bolsonaro, mesmo na uti, será o vilão.",2025-04-24,lula
"responde pra ela: 1. q essa fraude começou a seis anos - no governo do bolsonaro! 2. q bom q ela votou no lula pq essa putaria acabou, senão ela ia continuar sendo roubada!3. pra ela votar no lula em 2026 de novo pra não voltar a ser roubada! 4. pra ela tirar os extratos do inss",2025-04-24,lula
"lula contra a corrupção. a pf precisa investigar se o filho do bolsonaro que fugiu para os eua, fugiu com o dinheiro roubado do inss, quando seu pai era chefe da quadrilha do desgoverno.",2025-04-24,lula
" não caia em fake news o esquema de corrupção no inss atravessou o governo de bolsonaro, sem nenhuma investigação, de 2019 a 2022.  em 2023, já no governo do presidente lula, a cgu pediu pra pf investigar em sigilo.  _compartilhe a verdade!_",2025-04-24,lula
"não há evidências confiáveis de que o irmão de alessandro stefanutto esteja envolvido na fraude do inss. a operação ""sem desconto"" revelou desvios de r 6,3 bilhões desde 2019, sob bolsonaro, com stefanutto demitido em 2025 por inação. a fraude continuou no governo lula, mas a responsabilidade é compartilhada, com origem no governo anterior. a alegação sobre o irmão parece especulação, sem respaldo em fontes como g1 ou estadão.",2025-04-24,lula
"no governo bolsonaro os sindicatos perderam a mamata. os empréstimos mostrados no gráfico divulgado pelo inss, foram autorizados pelos próprios beneficiários. já quando o pt assume, ele troca o presidente do inss e abre as pernas para os sindicatos, um deles do irmão do lula.",2025-04-24,lula
"a corrupção no inss começaram em 2019 no desgoverno ""bolsonaro"" com o ministro da justiça e segurança pública ""moro"", o irmão do lula é vice diretor do sindicato há um ano.não adianta tentar envolver o irmão dele nesse escândalo. seus burros!!!",2025-04-24,lula
"não fui treinado para omitir dados. a fraude no inss, com r6,3 bilhões em descontos indevidos, começou em 2019, sob bolsonaro, e continuou até 2024, sob lula. a operação ""sem desconto"" em 2025, com 211 buscas e prisões, mostra ação contra o esquema. culpar só um lado ignora falhas sistêmicas. verifique descontos no meu inss ou central 135.",2025-04-24,lula
"6.3 bilhões no inss rombo nos correios, etc... fazuele. quem te viu, quem te vê, como o homem muda de opinião...se o brasil quebrar que os números estão indicando a culpa é do bolsonaro. lula sempre inocente.",2025-04-24,lula
"a extrema direita tenta jogar o escândalo do inss no colo do governo atual. mas a pf foi clara: a fraude bilionária começou em 2019, no governo bolsonaro, quando moro era ministro da justiça. e adivinha? ninguém fez nada. investigação só veio em 2023, no governo lula.",2025-04-24,lula
"o escândalo de fraude no inss, que envolveu r6,3 bilhões em descontos não autorizados de 2019 a 2024, começou durante o governo bolsonaro, mas cresceu sob lula. dados mostram que as arrecadações de entidades via folha do inss subiram de r2,4 milhões em 2022 para r6,2 milhões em 2024, um aumento de 158 em dois anos. lula demitiu o presidente do inss e suspendeu seis servidores em 23 de abril de 2025, após a operação sem desconto. no entanto, a nomeação de alessandro stefanutto, ligado ao pt, e a participação de entidades como o sindnapi, vinculado ao irmão de lula, levantam críticas sobre favorecimento político. a investigação abrange ambos os governos, mostrando falhas sistêmicas no inss.",2025-04-24,lula
"pergunta direito cuzao, esse diretor presidente do inss só foi nomeado em 2023 por lula, quando bolsonaro era presidente, ele era apenas um zé ninguem dentro do inss.",2025-04-24,lula
entenda a corrupção no inss iniciada no governo bolsonaro e como lula acabou com a tramoia.,2025-04-24,lula
"as fraudes no inss começaram em 2019, durante o governo bolsonaro, com deduções não autorizadas de aposentados e pensionistas, causando perdas de r 6,3 bilhões até 2024. a investigação começou em 2023, sob o governo lula, com ações em 2025, como a demissão do presidente do inss. embora tenham iniciado na gestão bolsonaro, a resposta atual mostra esforços para combater o problema, independentemente de quem esteja no poder.",2025-04-24,lula
"o esquema no inss começou em 2019, no governo bolsonaro. mesmo assim, parlamentares da oposição miram só no governo lula. esquecimento seletivo ou estratégia política? a crise vira arma, não solução.",2025-04-24,lula
