mensagem,data,aspecto
o artigo nao menciona q o bolsonaro entrou com uma medida provisória para impedir descontos irregulares no inss. confira.,2025-05-01,bolsonaro
"o ministro da previdência - ministro da previdência de bolsonaro, recebia dinheiro do roubo do inss direto na própria conta pessoal. ao sair do governo ele mudou de nome.",2025-05-02,bolsonaro
mais detalhes sobre a gang do inss. bolsonaro na cadeia.,2025-05-02,bolsonaro
"enquanto todos os brasileiros sofriam com as perdas de entes queridos, com as incertezas. sem saber se iriam sobreviver. os aposentados do inss eram roubados,pela quadrilha do bolsonaro ladrão de jóias",2025-05-02,bolsonaro
em 2018 (antes de bolsonaro): 18 associações autorizadas pelo inss. 2022 (fim do governo bolsonaro): 29 associações. cpi já!! dinheiro desviado do inss para a campanha de bolsonaro em 2022!,2025-05-02,bolsonaro
"e é verda que o ""careca do inss"" é bolsonarista, tendo inclusive doado para a campanha que pedia que se doasse 1 real como uma espécie de comprovante de voto para jair bolsonaro ?",2025-05-02,bolsonaro
"maior fraude do inss foi o bolsonaro conseguir se apresentar com apenas 33 anos de idade, e ele tem duas aposentadorias e salário pelo partido pl",2025-05-02,bolsonaro
" -inss: mais de 1.2milhões de pedidos de cancelamentos cgu contempla período entre janeiro de 2023 à junho de 2024 -análises de assuntos jurídicos da semana:: fraudes no inss, acesso de bolsonaro às provas do suposto golpe e outros temas…",2025-05-02,bolsonaro
"bolsonaro, lá atrás, lutou contra isso e até aprovou leis de combate a fraudes no inss. essa é a diferença entre um governo que combate a corrupção e um que é totalmente corrupto.",2025-05-02,bolsonaro
"deve estar falando da dilma, em 2016, quando começou. bolsonaro tentou blindar o inss, mais pt e psol foram contra.",2025-05-02,bolsonaro
"a quadrilha era do lado de lá!! bolsonaro agora vai pedir pra passar mais 1 ano no hospital! doação do inss para campanha do mito, o amigo do careca?",2025-05-02,bolsonaro
"bolsonaro foi um presidente fantástico, mas esqueceu de demitir os funcionários contratados nos governos anteriores. esses caras estão no inss desde o ano de 2005!!!",2025-05-02,bolsonaro
era inocente mas foi incompetente para identificar a roubalheira que estava acontecendo no inss que teve origem o governo do bolsonaro. proxima,2025-05-02,bolsonaro
"o esquema criminoso para roubar aposentados e pensionistas do inss foi montado no governo bolsonaro, em 2019 ministro da justiça: sérgio moro.",2025-05-02,bolsonaro
"o governo bolsonaro é ideológico,só se preocupava em estrangular a cultura,com ideologia nas escolas etc. não se ligou no inss.",2025-05-02,bolsonaro
"a roubalheira no inss vem antes do governo bolsonaro e o mesmo foi o único que combateu a fraude, porém a ptzada reassumiu o comando do país e liberou meterem a mão suja no dinheiro dos aposentados.",2025-05-02,bolsonaro
lembra desta traste? ela trabalhou para derrubar a lei que dificultaria roubo no inss sancionada por bolsonaro.,2025-05-03,bolsonaro
pegue o dinheiro que o bandido do bolsonaro robou do brasil e dol inss abastace esse tanques burros da direita.,2025-05-03,bolsonaro
"de onde surgiu essa maluca! tudo que aconteceu no inss tem nome e sobrenome: michel temmer e jair bolsonaro, onde está o pt?",2025-05-03,bolsonaro
"fraudes no inss: a extrema-direita tinha destruído a cgu para salvar família bolsonaro, diz deputado segundo o parlamentar, 'o próprio ministro da justiça de bolsonaro explicou por que a fraude do inss não foi investigada pelo governo do ex-mandatário'",2025-05-03,bolsonaro
bolsonaristas roubavam os velhinhos do inss e também roubavam nas vacinas. sāo todos canalhas! contando as horas para bolsonaro voltar pra uti.,2025-05-03,bolsonaro
"bolsonaro e seus aliados roubaram o inss, usaram e abusaram da máquina pública!",2025-05-03,bolsonaro
bolsonaro fraudou o inss.,2025-05-03,bolsonaro
bolsonaro e o careca do inss: entenda a ligação dos dois que agitou o ce... via,2025-05-03,bolsonaro
"44 bi isso é mais que 7 vezes o roubo do inss de 6 bi. vamos então dizer, que bolsonaro 22 estava sempre certo!",2025-05-02,bolsonaro
qto o careca que fraudou o inss deu para campanha do bolsonaro z?,2025-05-03,bolsonaro
explodiu!!! escândal0 do inss chega em bolsonaro e pode ser o fim!!! via,2025-05-03,bolsonaro
mpf pf pgr tcu stf a turma do inelegível capitão denunciado intimado jair bolsonaro está por trás de todas essas roubalheira do inss esses descontos indevidos aos aposentados e pensionistas do brasil bloqueia os bens de todos eles ...,2025-05-03,bolsonaro
"acho que você está desinformada pra variar sao os de direita um dos maiores fraudadores, conhecido por ""careca do inss"" foi doador de campanha do bolsonaro kkkkkkk",2025-05-03,bolsonaro
investigado em fraude no inss doou r 60 mil a ex-ministro de bolsonaro  revista fórum,2025-05-03,bolsonaro
ah se fosse no governo bolsonaro. nenhum dos ministros comentaristas do stf deu qualquer declaração sobre o roubo bilionário do inss,2025-05-03,bolsonaro
"urgente!!! pf confirma que onyx lorenzoni recebeu repasse de r 60 mil de empresa que roubava aposentados no esquema do inss!! ele era ministro da previdência no governo bolsonaro, o ministro da jusitça era sergio moro!!",2025-05-03,bolsonaro
quem imaginaria que o grupo de bolsonaro estaria implicado na fraude do inss - contém ironia flávio bolsonaro e ciro nogueira também foram mencionados,2025-05-03,bolsonaro
"do esquema da vacina ao esquema do inss: no desgoverno bolsonaro, a corrupção virou política de estado. enquanto o povo morria na fila do sus ou penava sem aposentadoria, a máquina pública era saqueada pelos aliados do ex-presidente. e ainda diziam que ""não tinha corrupção""?",2025-05-03,bolsonaro
alguma coisa a dizer sobre o roubo do inss? ou a preocupação de vocês se resume a perseguição a bolsonaro?,2025-05-03,bolsonaro
"a notícia sobre a fraude no inss é verdadeira, com a polícia federal apontando desvio de r 5,4 bilhões em descontos indevidos de pensionistas. porém, não há provas conclusivas de envolvimento direto de flávio bolsonaro, ciro nogueira, onyx lorenzoni ou ricardo barros. há ligações indiretas via maurício camisotti, ligado ao partido de nogueira e barros, mas são baseadas em associações, não evidências sólidas. casos de corrupção de flávio bolsonaro, como a ""rachadinha"", não têm relação com o inss, e onyx não tem conexão clara. barros nega envolvimento, e algumas investigações foram arquivadas. o caso é controverso, com debates sobre o alcance político.",2025-05-03,bolsonaro
"todos os dias vai aparecer um integrante da quadrilha do inss,ao lado do bolsonaro ladrão de jóias",2025-05-03,bolsonaro
se o roubo no inss era obra do bolsonaro por que o lupi caiu?,2025-05-03,bolsonaro
"vamos desmascarar de uma vez por todas os esquerdistas sem caráter, que insistem em dizer que a fraude do inss começou no governo bolsonaro. os números não mentem",2025-05-03,bolsonaro
"se o roubo do inss era obra do bolsonaro, por que todos os deputados da esquerda se recusaram a assinar o pedido de cpi para investigar o roubo dos aposentados e pensionistas?",2025-05-03,bolsonaro
globolixo cúmplices de satanás  e sua quadrilha de trevas sádicos e crueis fraude inss contra vuneravel e pouco. com certeza tem muito mais roubalheira presidente bolsonaro avisou,2025-05-03,bolsonaro
"""começa a aparecer o nome de onix lorenzoni, ex ministro de quase tudo no governo bolsonaro, no escândalo do inss."" antropofagista:",2025-05-03,bolsonaro
"vc sabia? a senadora q se descabelou pra condenar bolsonaro durante o espetáculo circense da cpi da covid-19, eis sua performance no estouro da vergonha assaltante do inss!",2025-05-03,bolsonaro
"certinha todos sabiam que onde tem os dedos sujos do bolsonaro é podre como ele. vocês da direita são um povo sem caráter, o brasil sabe que o roubo do inss foi com o bolsonaro e nem vem lacrar aqui , aqui o buraco é mais embaixo canalhadas",2025-05-03,bolsonaro
"vocês da direita são um povo sem caráter, o brasil sabe que o roubo do inss foi com o bolsonaro e nem vem lacrar aqui , aqui o buraco é mais embaixo canalhadas",2025-05-03,bolsonaro
fraude no inss: o elo com governo bolsonaro e as supostas propinas a ciro nogueira e ricardo barros,2025-05-03,bolsonaro
em 2019 bolsonaro sancionou medida provisória para combater fraudes no inss mas em 2022...a esquerda e o pt é um câncer no brasil.,2025-05-03,bolsonaro
governo metralha só querem roubar o povo brasileiro maior prova acusa bolsonaro mas não assina cpi do inss não querem achar protesto pra incriminar o bolsonaro mas não né pois sabem que é o partido dos trambiqueiros o culpado...,2025-05-03,bolsonaro
"os roubos investigados começaram durante a gestão de temer, vice de dilma, eleito por petistas. logo no início 2019, o presidente bolsonaro lançou a mp 8712019 para impedir fraudes no inss.o pt, com a ajuda das entidades investigadas, conseguiu revogar a lei antifraude em 2022.",2025-05-03,bolsonaro
kkkkk. bolsonaro pediu investigação no inss e o nine cancelu o decreto qdo entrou,2025-05-03,bolsonaro
"a mp 8712019, assinada por jair bolsonaro em janeiro de 2019, visava combater fraudes no inss. convertida na lei 13.8462019, instituiu o programa especial para análise de benefícios com indícios de irregularidade, com revisões de benefícios, bônus a funcionários para detectar fraudes e regras mais rígidas para benefícios rurais. estimava economizar 9,8 bilhões de reais anualmente, usando dados da receita federal, sus e fgts.",2025-05-03,bolsonaro
"por isso nenhum da vossa laia assinou a cpi né…rabo bem preso, já de 2004 a 2014 deram um rombo no inss de 524 bilhões…só falta dizerem q foi tbem bolsonaro ",2025-05-03,bolsonaro
"pt é a maior... fábrica de bandidos e vagabundos do planeta!!!!! toda vez que, investigam o bolsonaro. descobrem mais.... crimes do pt!!!!",2025-05-03,bolsonaro
"exatamente a parte ""a fraude no inss começou no governo bolsonaro""",2025-05-03,bolsonaro
" na verdade tudo começou no desgoverno do ladrão de joias em 2019. isso esta comprovadíssimo. tanto que o ""careca do inss é apontado como principal responsável por fraudes. o lobista ""careca do inss"" doou r 1 para campanha de bolsonaro em 2022. ele recebeu r 53,88 milhões de associações envolvidas no esquema e fez repasses milionários para servidores do órgão suspeitos de participação nos crimes.",2025-05-03,bolsonaro
"""ministro de bolsonaro recebeu dinheiro roubado dos aposentados do inss"", diz pf",2025-05-03,bolsonaro
pior ver japonês dizer que o roubo do inss veio no governo bolsonaro ! esse ladrão de esquema da rachadinha chamado andre japonês,2025-05-03,bolsonaro
"parece que o roubo do inss é coisa do governo bolsonaro com início em 2019, no esquentar das investigações virá os nomes patriotas que faziam parte do esquema...",2025-05-03,bolsonaro
"sempre teve roubalheira no inss, lembram da georgina??? o bolsonaro tentou por freios na roubalheira e como sempre a mesma corja maldita votou contra.",2025-05-03,bolsonaro
surreal é vc vir falar que seu mito sancionou uma lei anti corrupção e não ser capaz de dizer por que ele não a usou durante os 4 anos que governou e sequer mandou investigar o roubo no inss! me diga um corrupto que foi preso no governo bolsonaro ou uma operação da pf.,2025-05-03,bolsonaro
agora estão procurando ligações dos ladrões dos inss pra chegar em bolsonaro,2025-05-03,bolsonaro
"flávio bolsonaro apareceu no esquema do inss ricardo barros, ex ministro do frouxo, tbm",2025-05-03,bolsonaro
" política l bastou o escândalo do inss chegar em temer, bolsonaro e tarcísio que os jornalões sumiram com as manchetes sobre o tema, aponta site",2025-05-03,bolsonaro
"onde é que foi parar, nesse gráfico, o procurador que levou 11 milhões dos aposentados, via careca do inss, e foi nomeado em 2020 no governo bolsonaro? sumiu?",2025-05-03,bolsonaro
"bomba no stf! 2 o jornalista as, q está exilado no eua, tem 1 informante do crime organizado dentro da corte. ele citou o jornal metrópoles como fonte de informação. somado a ilegalidade da intimação do pr bolsonaro, os roubos do inss, esse assunto poderá abalar  a república.",2025-05-03,bolsonaro
a coisa tá ficando linda. bóra que bóra policia federal bolsonaro fraudou o inss,2025-05-03,bolsonaro
volta bolsonaro! pois o brasil virou novamente o país da corrupção. ,2025-05-03,bolsonaro
"a corrupção na previdência só foi descoberta porque venceu as eleições, se fosse bolsonaro o delegado da pf teria sido trocados e o processo levaria 100 anos de sigilo!",2025-05-04,bolsonaro
agora vem falando de mais um escândalo que se iniciou no governo de bolsonaro : corrupção do inss foi a herança que deixou para os brasileiro.,2025-05-04,bolsonaro
"minha senhora, você é fã e acredita no bolsonaro. o cara rouba, é confirmado a roubalheira e você ainda defende. sejamos honestos que não devíamos ser fã de ninguém pois eles deveriam nos servir. mas... agora no quesito corrupção no inss, oriento vc a buscar sua origem. ",2025-05-04,bolsonaro
"para com mentiras!!! voces sao cumplices de satanás  e sua quadrilha de trevas fraude inss, educação,seguranca etc...maioria de suas vítimas sao os pobre e vulneráveis presidente bolsonaro avisou",2025-05-04,bolsonaro
tu ainda não entendeu que bolsonaro pode pear mais 10anos pelos roubos no inss? fica quieto cara!,2025-05-04,bolsonaro
"isso me traz uma constatação: se a pandemia da covid fosse no governo biden, não haveria a histeria que houve. se o escândalo das fraudes do inss estoura no governo de bolsonaro, o mundo viria abaixo. fato!",2025-05-04,bolsonaro
"qial escândalo de corrupção teve no governo bolsonaro? o 70.000 da michelle não compra 1 sofá da janja... tu é muito ridículo! 6 bilhões só no inss. e nós correios, petrobrás, janjapaloosa... picanheiro vagabundo",2025-05-04,bolsonaro
"globolixo isso e fake news voces sao cumplices de satanás  e sua quadrilha de trevas fraude inss,golpes,,, roubalheira sem fim,mentiras desumanas para defender criminosos presidente bolsonaro avisou",2025-05-04,bolsonaro
"é uma organização criminos. nunca foi partido. e o povo imbecil vota nesses bandidos. e hoje o stf faz parte. quando algum esquerdista falar que o bolsonaro fazia parte do golpe do inss, manda esse vídeo. só os petistas jumemtoides não sabem disso!",2025-05-04,bolsonaro
"bolsonaro em.2019 sancionou uma lei que acabava com esses descontos... em 2022 derrubaram a lei... o atual presidente do inss, nesse período era diretor de finanças... o sindicato do irmão do ladrão foi o que mais faturou c a fraude...sem falar da omissão de carlos lupi....",2025-05-04,bolsonaro
bora de cpi ?  bolsonaro roubou o inss.,2025-05-04,bolsonaro
mas o roubo do inss pra quem não sabe foi na gestão do bolsonaro certo?? vamos procurar entender direito.,2025-05-04,bolsonaro
"vamos lá : subiu 47 posições: no roubo, nos escândalos do inss, caixa econômica e assim vai! bolsonaro: a pedra no sapato, o cara, que mudou o país, pra melhor! e tu amante, faz propaganda de graça pro bolsonaro!",2025-05-04,bolsonaro
"há indícios de envolvimento de pessoas do governo bolsonaro no esquema de corrupção do inss. alexandre guimarães, ex-diretor do inss, é acusado de receber r313 mil de um figura central no esquema. josé carlos oliveira, ex-ministro, é citado por ligações com entidades investigadas, mas não é formalmente investigado. a fraude ocorreu de 2019 a 2024, abrangendo os dois governos, e ambos se acusam mutuamente. as investigações continuam para esclarecer responsabilidades.",2025-05-04,bolsonaro
"se a esquerda culpa o governo bolsonaro sobre a fraude no inss, porque você foi contra a cpi ? a cpi não seria pra descobrir os envolvidos no esquema ! porque você é contra a cpi ?",2025-05-04,bolsonaro
bolsonaro o maior corrupto de todos os tempos. de rachadinha até roubar velhinho no inss. kkkkkkkkk,2025-05-04,bolsonaro
"merecem mesmo. a propósito... quem está culpando o bolsonaro nas redes pelo inss é a esquerda que por sinal se fez de louca e não assinou a cpmi. veja na gleisi, lindinho, vampiro, o veio rogério corrêa.. só falam no mito 24hs. se liga! não nos culpe por algo que vcs fizeram.",2025-05-04,bolsonaro
"entenda a fraude no inss em linguagem simples, como a fraude ocorreu e as ações que o presidente bolsonaro... adotou",2025-05-04,bolsonaro
"voltou ao mesmo ""argumento"" não consegue desfazer o roubo de 3,5 bilhões nas prefeituras do rio. nem proteger o careca do inss e o mauricio do pp, nem lorenzoni, nem ex ministros do bolsonaro... então ataca o interlocutor... típico de um acéfalo",2025-05-04,bolsonaro
foi seu macho bolsonaro que roubou o inss,2025-05-04,bolsonaro
aqui acaba com toda narrativa esquerdista sobre bolsonaro-inss.,2025-05-04,bolsonaro
"caro deputado.lembra quando esse esquema fraudulento começou? ou sua memória deveras seletiva. fala assim:""fraude do inss que começou no governo do meu comparsa bolsonaro,tinha presidente de entidades que recebiam o bolsa família,programa criado pelo pt para ajudar aos pobres"".",2025-05-04,bolsonaro
provas que no governo bolsonaro ele tentou acabar com as fraudes do inss!!,2025-05-04,bolsonaro
mau sabe essa senhora que com essa atitude quem se rebaixa direto ao lixo e ela mesmo ela esqueceu de perguntar pra ministra em qual governo começou a fraude do inss que foi nos governo temer e bolsonaro ambos de direita e só pirou nesse governo de esquerda irônico pt não presta,2025-05-04,bolsonaro
"líder do pl, sóstenes cavalcante, pede afastamento do novo ministro da previdência à pgr. partido de bolsonaro alega que wolney queiroz foi omisso diante das suspeitas de fraudes no inss via",2025-05-04,bolsonaro
mais um esclarecimento de tantos que o governo bolsonaro tomou para estancar os roubos que às associações e sindicatos vinha praticando contra os velhinhos do inss ! cpi já ,2025-05-04,bolsonaro
quando se iniciou essas fraudes no inss? e quais providências o bolsonaro tomou?,2025-05-04,bolsonaro
"em 2019, jair bolsonaro editou a medida provisória 8712019 para combater fraudes no inss, que foi convertida na lei 13.8462019. a medida criou programas para revisar benefícios com indícios de irregularidades, apertou regras para trabalhadores rurais e auxílio-reclusão, e permitiu acesso a dados para fiscalização. estimava-se economizar r9,8 bilhões revisando 5,5 milhões de benefícios. apesar de algum impacto, fraudes persistiram, como visto em esquema de 2025 que levou à demissão do presidente do inss. algumas regras foram revogadas em 2022, enfraquecendo a lei. a iniciativa teve sucesso parcial, mas não resolveu completamente o problema.",2025-05-04,bolsonaro
"a mp 8712019, sancionada por bolsonaro, virou a lei 13.8462019 e buscava combater fraudes no inss, revisando benefícios e estimando economia de r9,8 bilhões. foi aprovada, mas criticada por dificultar acesso a benefícios legítimos, sendo revogada em 2022. sobre os senadores que votaram contra, sabe-se que o bloco do pt, incluindo humberto costa, opôs-se à medida, com 12 votos contrários contra 55 a favor. porém, a lista nominal detalhada não está publicamente disponível em fontes acessíveis. fraudes no inss, iniciadas em 2019, continuaram até 2024, totalizando r6,3 bilhões, o que mostra que o problema persiste, independente de governo.",2025-05-04,bolsonaro
"acredito que e possam ter o raciocínio um pouquinho lento. explique à eles em português claro, quando começou o esquema de corrupção do inss, e por quais motivos, no governo do jair messias bolsonaro, não foi investigado e não foi deflagrado.",2025-05-04,bolsonaro
será pq as fraudes no inss não foram investigadas nos 4 anos do governo bolsonaro?,2025-05-04,bolsonaro
"a senadora eliziane gama (psd-ma) liderou a articulação que eliminou, em 2019, a mp 87119, convertida em lei, de jair bolsonaro, que estabelecia um conjunto de ações para coibir fraudes no inss, mas o cn revogou a lei, facilitando a ação de golpistas.",2025-05-04,bolsonaro
"a fraude do inss começou 2019, e bolsonaro prometeu que iria continuar fazendo descontos de 25 em 2023",2025-05-04,bolsonaro
"olha o bolsonaro aí fazendo escola de corrupção kakakkakakakakakakakakajkaa comecou no governo bolsonaro, seu gado",2025-05-04,bolsonaro
" alerta! bolsonaristas estão divulgando a lei que bolsonaro sancionou sobre o combate as fraudes no inss, justificando o não envolvimento do seu governo no esquemade descontos indevidos...mas, a verdade é essa que explico esse argumento é o que os bolsonaristas estão usando para justificar o não envolvimento do governo bolsonaro na corrupção. a mp que ele criou era sobre revisão das aposentadorias e outros benefícios, auxílio reclusão , e perícia médica. bolsonaro ia cortar aposentadorias e benefícios bpc para os idosos, para isso ele colocou 7000 militares sanguessugas para prejudicar o povo brasileiro, não tem nada a ver sobre o escândalo de descontos indevidos, essa corrupção que se estabeleceu no governo dele. o governo bolsonaro passou a dificultar a concessão de benefícios e aposentadorias, cancelou muitos benefícios, e aumentou a fila do inss, daí as entidades ligadas a oposição pressionaram o congresso para modificar partes da medida provisória, mas mesmo assim, o povo continuou sendo prejudicado. paulo guedes e bolsonaro tinham o objetivo de acabar com as aposentadorias ao longo do governo, se ele tivesse sido reeleito, seria o caos para o pobre trabalhador...",2025-05-04,bolsonaro
"até o sabe a verdade, enqto outros tentam jogar nas costas do bolsonaro, o roubo do inss kkkkk",2025-05-04,bolsonaro
"se houver uma cpi do inss, como quer a extrema-direita, bolsonaro poderá ser responsabilizado, pois, no governo dele, as fraudes já estavam acontecendo.",2025-05-05,bolsonaro
no governo do ladrão do bolsonaro esse ladrão do inss vocês defendem ne burros da direita.,2025-05-05,bolsonaro
"meu deus… a coisa só cresce!  oh povinho da treva esse… tudo tão errado e torto, tão distante de suas falas em deus!!!  bolsonaro envolvido na fraude do inssgilmar e pf barram anistiadeputa... via",2025-05-05,bolsonaro
"urgente: 7 entidades envolvidas no escândalo de corrupção do inss tiveram convênios assinados durante o governo bolsonaro. ministro bolsonarista da previdência, que deveria investigar, recebeu r 60 mil de um dos acusados da roubalheira e não investigou o esquema. iiiii!!!!",2025-05-05,bolsonaro
"muito sério! vi os posts dele do insta e do x. atuante no governo bolsonaro, curiosamente com o no poder, não existem mais erros. não deu um pio sobre a fraude do inss, uma pena, não devemos ter políticos de estimação.",2025-05-05,bolsonaro
nikolas quem é i careca do inss que os militantes da esquerda estão colocando na conta do bolsonaro. procura saber..,2025-05-05,bolsonaro
"se foi culpa do bolsonaro tá fácil, pede a cpmi do inss, essa eu quero ver!",2025-05-05,bolsonaro
foi bolsonaro,2025-05-05,bolsonaro
eis o pt derrubando a medida que bolsonaro editou em 2019 para barrar a roubalheira no inss.,2025-05-05,bolsonaro
"oba! queremos saber pq nos governos temer e bolsonaro nada foi feito, ja que o roubo acontece desde 2016. queremos saber mais sobre o bolsonarista ""careca do inss"" e seu parça, indicado ao inss por bolsonaro.",2025-05-05,bolsonaro
"se a culpa é do bolsonaro, por que os esquerdalhas estão lutando contra a cpmi do inss?",2025-05-05,bolsonaro
congresso revogou lei antifraude de bolsonaro que barrava esquema bilionário no inss,2025-05-05,bolsonaro
"então sete dos nove convênios suspeitos pela fraude no inss foram assinados no governo bolsonaro. ele mesmo, que empurrava corrupção para debaixo do tapete. e ainda há quem diga que não tem culpa de nada.",2025-05-05,bolsonaro
bolsonaro tentou blindar o inss. a esquerda foi contra.,2025-05-05,bolsonaro
"senador vamos fazer o seguinte, vamos ferrar o bolsonaro, pede a cpmi do inss, mostra que vc é o cara!!! vai lá senador mostra a sua grandeza, simples assim.",2025-05-05,bolsonaro
sem anistia bolsonaro roubou o inss,2025-05-05,bolsonaro
"poderia me informar quais sindicatos, no brasil, apoiam a direita ou a extrema direita? dentre os sindicatos que estao envolvidos na fraude do inss, quais apoiaram bolsonaro?",2025-05-05,bolsonaro
"se o globo tá postando sem nenhum ""mas"", com semiótica favorável a bolsonaro, pode crer que é cortina de fumaça. não me surpreenderia que tenha sido brifado para tirar o foco do roubo dos aposentados no inss.",2025-05-05,bolsonaro
"uai foi ou não o bolsonaro que roubou o inss, pq não parece q foi ele igual a esquerda disse.",2025-05-05,bolsonaro
"em outro trecho da entrevista, o senador rogério marinho fala sobre a mp87119, sancionada durante o governo bolsonaro, que estabelecia uma série de ações para coibir as fraudes no inss.",2025-05-05,bolsonaro
"bastou o escândalo do inss chegar em temer, bolsonaro e tarcísio que os jornalões sumiram com as manchetes sobre o tema",2025-05-05,bolsonaro
"as hipocrisias da leitoa hipócrita. bolsonaro , determinou , em 2019 , investigações no inss. desinformação do pix generoso.",2025-05-05,bolsonaro
"90bi, vão fazer o que agora ? culpar e prender bolsonaro ? com falsas acusações? a casa caiu o bebum ferrou o inss de vez",2025-05-05,bolsonaro
