mensagem,data,aspecto
"a medida provisória 871 foi criada em 18 de janeiro de 2019, durante o governo de jair bolsonaro, com o objetivo de combater fraudes no sistema previdenciário do inss. ela instituiu programas de revisão de benefícios com indícios de irregularidades e ofereceu bônus a funcionários por identificação de fraudes, visando economizar recursos públicos. críticos, porém, afirmam que a medida dificultou o acesso de beneficiários legítimos, especialmente trabalhadores rurais, sem focar grandes fraudadores. escândalos recentes, como a operação no discount em 2025, mostram que fraudes persistiram entre 2019 e 2024, sugerindo impacto limitado da mp.",2025-05-08,bolsonaro
"falou sim falou que fraude no inss começou em 2018, no governo temer, e se fortaleceu durante o governo bolsonaro, entre 2019 e 2022. foram anos sem investigação só agora, no governo , a investigação foi deflagrada, os acordos suspeitos suspensos e os responsáveis.",2025-05-08,bolsonaro
"hoje escândalo do inss, amanhã escândalo do botijão, depois de amanhã escândalo da cebola, depois de amanhã... se fosse o bolsonaro, se o coitado espirrasse já estava preso, é engraçado, já que o ginomo de novo dedos que está no poder, bem, ""foi só brincadeira"" e ruim em.",2025-05-08,bolsonaro
"em 2022, bolsonaro sancionou leis como a lei do orçamento e a lei 14.438, sobre microcrédito e fgts, mas nenhuma focada diretamente em fraudes no inss. a lei 13.8462019, que ele sancionou em 2019 para combater fraudes, teve regras alteradas pelo congresso em 2022, não por nova lei dele. a fraude no inss, que pode chegar a r 210 bilhões, começou a crescer em 2019, com investigações iniciadas em 2023.",2025-05-08,bolsonaro
" bolsonaro sempre soube das fraudes no inss e nada fez ... o esquema de corrupção no inss começou em 2019, no governo de jair bolsonaro. ... (segue)",2025-05-08,bolsonaro
"a dona amante culpa o bolsonaro mas ao mesmo tempo quer impedir a cpi do inss . quem não deve não teme , né !!",2025-05-08,bolsonaro
"não enche nem meia calçada! vc acredita em golpe?sem exército?sem armas?sem prisão dos que estão no poder?vai pqp se vc acredita nisso por militância!vamos nos processos legais, destruição, vandalismo, invasão,etc! já se vão 3 anos e ainda no golpe,bolsonaro!enquanto isso no inss",2025-05-08,bolsonaro
é verdade que o bolsonaro montou a quadrilha para roubar o inss? ou o sobrinho petista da dilma rousseff está mentindo? (como um bom e velho petista).,2025-05-08,bolsonaro
é... o bolsonaro dando golpe enquanto deixava roubarem no inss... no meio da pandemia! vai ser difícil encobrir! por que não investigaram nada no governo bolsonaro?,2025-05-08,bolsonaro
é... o bolsonaro dando golpe enquanto deixava roubarem no inss... no meio da pandemia! vai ser difícil encobrir!,2025-05-08,bolsonaro
vc só esqueceu de falar que a corrupção do inss começou no desgoverno bolsonaro,2025-05-08,bolsonaro
se foi bolsonaro que flaudo o inss por que os deputados do pt não votou a favor da cpi do inss mim respondao por favor,2025-05-08,bolsonaro
"??? estranho, não (?) quem estava acusando o governo temer e bolsonaro pelo esquema de fraudes no inss, pede a todos apoio para não aprovarem a cpi ou cpmi dos aposentados do inss. cpi neles! esses bandidos não podem continuar soltos.",2025-05-08,bolsonaro
"o advogado-geral da união, jorge messias, afirmou nesta quinta-feira (8) que o esquema de descontos indevidos em aposentadorias e pensões do inss foi estruturado durante a gestão do ex-presidente jair bolsonaro (pl)",2025-05-08,bolsonaro
"bolsonaro fez vista grossa a não investigar as fraudes no inss quando foi presidente, para de contar mentiras deputado seja mais coerente com as intenções.",2025-05-08,bolsonaro
"corrigindo a informação: no governo bolsonaro houve modificação na lei. congresso flexibilizou regra que restringia esquema no inss primeiro movimento ocorreu em 2019 e o segundo no ano de 2022 (fonte cnn brasil, 24042025)",2025-05-08,bolsonaro
zeronimo está coberto ele pode? pois é do grupo sindicalistas que governam o brasil vide inss e os velhinhos aposentados e que muitos também votaram em bolsonaro e o hitler baino quer mandar para cala empurrada oeka enchedeira ou carregadeira hi geronimo,2025-05-08,bolsonaro
- os roubos acontecem desde 2016; - 2019: bolsonaro cria medida provisória p combater fraudes no inss; - congresso encabeçado pela esquerdapt derruba essa medida; - 20232024: as fraudes tem aumento absurdo. - 2025: esquerdapt é contra a cpmi p investigar essas fraudes. ,2025-05-08,bolsonaro
"vc tbm ta compartilhando fake news, o esquema comecou em 2016, em 2019 o bolsonaro fez uma lei anti-fraude do inss. em 2022, o congresso derrubou a lei. a partir de entao, o valor da fraude subiu muito mais que 100",2025-05-08,bolsonaro
"se começou com bolsonaro, deixe abrir a cpi do inss!!! ahh... o pt não quer né?!!!! porquê será?",2025-05-08,bolsonaro
por que nao prenderam o ex presidente do inss do governo bolsonaro que arquitetou o furto sobre os aposentados?,2025-05-08,bolsonaro
"é burro ou se faz de? bolsonaro quis abrir a cpi pra investigar a fraude do inss e o pt não apoiou. e sobre o dinheiro vai devolver como? vai tirar do povo duas vezes? até pra ser uma anta tem limites. é uma vergonha quem apoia político corrupto, tem que se lascar mesmo.",2025-05-09,bolsonaro
jair bolsonaro deu fraude no inss,2025-05-09,bolsonaro
"alguém do pt pode me responder… se o roubo do inss é culpa do bolsonaro, porque ninguém do pt assinou a cpi para investigar?",2025-05-09,bolsonaro
com a idade que você tem deveria ter vergonha na cara e não ser desonesto e não disseminar mentiras. até uma criança pode perceber a edição dos vídeos dessa porcaria que você publicou. assista ai o que o bolsonaro fez pra combater as fraudes no inss em sua gestão,2025-05-09,bolsonaro
"e agora? como culpar bolsonaro  mais fraude no inss no programa ""inss vale"", que foi criado em 2024, operado pelo picpay que é dos irmãos b4tist4. agora vai pra quantos bilhões? a última contagem passava de 219 bilhões.",2025-05-09,bolsonaro
"pera lá, se o rombo do inss foi no governo bolsonaro, porque ninguém do pt assinou a cpi pra poder investigar? ",2025-05-09,bolsonaro
"o principal político preso no mensalão foi o presidente do partido do bolsonaro, que foi até preso! bolsonaro recebeu na última eleição doação milionária na campanha de principais suspeitos de roubo do inss.",2025-05-09,bolsonaro
deputada questiona cgu sobre fraudes no inss sob gestões temer e bolsonaro,2025-05-09,bolsonaro
"bolsonaro destruiu a lava jato e impediu a criação de novas forças-tarefas(principal meio de combate a corrupção), o que hoje favorece o escândalo no inss. o brasileiro não deve mover um músculo enquanto continuar preso à própria ignorância.",2025-05-09,bolsonaro
"é o stf dizendo que um artigo da constituição é inconstitucional... é o bessias dizendo que a culpa da fraude do inss é do bolsonaro e não do ladrão... é o janones, mais conhecido como rachadones, imitando o nikolas ferreira e tentando refutá-lo... tropa... é brasil!",2025-05-09,bolsonaro
isso logo após desconsiderar o pcc como uma entidade terrorista! pq processar então? é como dizer q o escândalo do inss é culpa do bolsonaro e não votar pela cpi!,2025-05-09,bolsonaro
"mentiroso cara de pau !!! não adianta querer desmentir o nikolas , todos sabem que bolsonaro em 2019 enviou mp contra a corrupção no inss e em 2022 o congresso por iniciativa do pt , revogou a lei . agora explodiu de vez o escândalo nesse desgoverno, bilhões são roubados !",2025-05-09,bolsonaro
"acho que foi bolsonaro quem criou o inss. e afinal, quando ela vai devolver o dinheiro surrupiado do postalis?",2025-05-09,bolsonaro
"quais partidos voltaram em 2022 para revogar a lei anti fraude do inss, sancionada em 2019, pelo ex presidente jair bolsonaro?",2025-05-09,bolsonaro
" mutirão para revelar a verdade sobre o caso do inss! _entenda todo o esquema do roubo das aposentadorias do inss._ segundo a polícia federal, o esquema começou no governo bolsonaro e se prolongou durante todo seu mandato, com a ajuda de seus aliados e criminosos. ",2025-05-09,bolsonaro
"em 2019, bolsonaro editou a mp 871 e, depois, sancionou a lei - dela originada - de combate às fraudes no inss, protegendo bilhões dos nossos aposentados. enquanto bolsonaro lutava contra o roubo, o atual desgoverno abre as portas da corrupção.",2025-05-09,bolsonaro
"se o roubo do inss é culpa do governo bolsonaro, por que ninguém do pt assinou a cpi para poder investigar?",2025-05-09,bolsonaro
"em função das assinaturas dos convênios desde 1991, porém desordenados desde 2019, graças a liberação de meios de controle chancelada por bolsonaro, o inss é responsável, ou seja, o governo de turno. quê dinheiro vc quer que qualquer executivo use ressarcir os prejudicados?",2025-05-09,bolsonaro
"mas jumentildo o projeto advindo do governo federal está em trâmite, não foi sua mãe quem indicou não. sobre o esquema do inss ele foi dissolvido agora, ele iniciou no governo bolsonaro com participação importante do presidente facilitando a ação. para de ser tosco.",2025-05-09,bolsonaro
grande dia. muita gente provando que o nikolas ferreira mentiu e mostrando que o maior culpado pelo rombo do inss é o bolsonaro corrupto,2025-05-09,bolsonaro
careca do inss doou para a campanha do bolsonaro,2025-05-09,bolsonaro
"0,1338 do roubo de r 219 bi do inss! ah se fosse bolsonaro!",2025-05-09,bolsonaro
"imagina se ele fizesse rachadinha… falando nisso, vc vai assinar a cpi do inss ??? já que vc acusa de ter começado os roubos no governo do presidente bolsonaro.",2025-05-09,bolsonaro
nikolas ferreira jóias micheque rachadinha inss favio bolsonaro carlos bolsonaro eduardo bolsonaro bananinha nikolas ferreira cassado mentiroso fraude inss,2025-05-08,bolsonaro
"o roubo começou no governo da sua tia, seu pangaré. bolsonaro editou uma medida para por fim a corrupção no inss e a esquerda inteira votou para derrubar a medida, para facilitar o roubo. vocês são ladrões.",2025-05-09,bolsonaro
"a pergunta que não quer calar é: se o roubo do inss aconteceu no governo anterior, se é tudo culpa do bolsonaro, por quê ninguém do pt assinou a cpi para investigar?",2025-05-09,bolsonaro
fato  bolsonaro com 107 imóveis de luxo comprados com dinheiro em espécie… fato 2  principal investigado na fraude do inss financiou campanha do bolsonaro…,2025-05-09,bolsonaro
porque a esquerda não assina a cpi do inss se quem fraudou foi bolsonaro? o que vocês temem?,2025-05-09,bolsonaro
porque ninguém do pt votou favor da cpi da fraude do inss se estão colocando a culpa no bolsonaro ??????  essa narrativa não está colando de jeito nenhum kkkkkkkk,2025-05-09,bolsonaro
fraude é desde 2016 bolsonaro quis acabar com as fraudes bancada lixo de esquerda derrubou a mp do bolsonaro cite qual atitude facista do bolsonaro vc consegue segue o link pra esfregar na sua cara que bolsonaro quis acabar com os descontos do inss,2025-05-09,bolsonaro
"bolsonaro é fraco e precisou ceder em quase tudo. não seja desonesto, se vc acompanhou minimamente o governo na gestão dele, deve se lembrar que tudo o q esse arrombado tentou fazer era duramente criticado, inclusive a tentativa de dificultar que botassem a mão no inss",2025-05-09,bolsonaro
"se o roubo é do governo do bolsonaro, porque ninguém do pt assinou a favor da cpmi do inss?",2025-05-09,bolsonaro
"na corrupção o que conta são os menos corruptos e melhores gestores, é disso que estou falando. e da história tô falando de um país, só pra ser mais recente de 64 a 2002 (e gov.bolsonaro) foi governado e saqueado pela direita e sobre o inss vem do governo passado e esse combateu.",2025-05-09,bolsonaro
"acabou-se a manobra para livrar bolsonaro da cadeia, a narrativa agora é a cpi do inss.",2025-05-09,bolsonaro
"o ladrao do inss é o ""careca do inss"" foi ele quem doou 53 milhões a última campanha de bolsonaro.",2025-05-09,bolsonaro
"e assim não defendo o bolsonaro não, mas entendo tb que esse tipo de narrativa fortalece ainda mais ele, e temos que ser honestos né ....",2025-05-09,bolsonaro
"no seu primeiro mês de governo, bolsonaro assinou a medida provisória para combater as fraudes do inss. o registro está aqui ",2019-01-18,bolsonaro
e por que todos os parlamentares petistas não votaram para cpi do inss??????? já que foi implantado por bolsonaro vcs não deveriam deixar de investigar e ferrar com o bolsonaro. ou será que o pt é idealizador dessa corrupção?,2025-05-09,bolsonaro
"o rei das rachadonas está cada dia pior. vejam, quem derrubou a lei antifraude do bolsonaro ao inss. esse desqualificado, acha que todos nós temos cérebro de ptista. vejam que derrubou a lei antifraude muita canalhice da gentalha",2025-05-09,bolsonaro
"bolsonaro entregou o inss assim como terceirizou os recursos públicos com o orçamento secreto, jair bolsonaro entregou a gestão do inss a uma quadrilha e não deixou investigar! enquanto isso, passou 4 anos em uma campanha mentirosa contra as urnas eletrônicas!",2025-05-09,bolsonaro
"é, né?! o assalto ao inss é culpa do bolsonaro; os juros altos é culpa do presidente do banco central indicado pelo bolsonaro; e por aí vai! nada é culpa dos lixos que ocupam o poder nesse momento!",2025-05-09,bolsonaro
pt 23:59 bolsonaro roubou o inss 0:00 contra a cpmi do inss,2025-05-09,bolsonaro
pq nenhum petista assinou a cpi do inss?? porque os partidos de esquerda junto com o centrão derrubaram a medida provisória de bolsonaro que barrou a fraude no seu mandato de acordo com gráfico da polícia federal?? esse povo é retardado e acha que a mídia tem força de impor isso,2025-05-09,bolsonaro
"a lei nº 14.438 de 2022, sancionada por jair bolsonaro, é apontada como a legislação que contribuiu para fraudes no inss. originada da mp 1107, ela revogou a exigência de revalidação periódica de descontos em benefícios, um mecanismo que visava garantir a autorização dos beneficiários. essa mudança, influenciada pelo congresso, removeu uma camada de fiscalização, facilitando descontos não autorizados. no entanto, fraudes já ocorriam antes de 2022, e sua escalada posterior sugere problemas sistêmicos, como má gestão. a responsabilidade é debatida, com críticas tanto à sanção de bolsonaro quanto à administração subsequente.",2025-05-09,bolsonaro
"a verdade, todos já sabem. bolsonaro, criou uma lei antifraude, para o inss. mas o pt e o psol, derrubaram ela no congresso. tudo documentado. tem o gráfico também, lindinho da lista da empreiteira",2025-05-09,bolsonaro
"não há evidências de que a tentativa de privatizar a dataprev por bolsonaro tenha contribuído diretamente para fraudes no inss, já que a empresa permaneceu estatal. as fraudes, que envolveram descontos indevidos de r6,3 bilhões (2019-2024), estão mais ligadas a mudanças legislativas, como a lei de 2022 que reduziu controles sobre descontos, e a falhas na gestão do inss. embora alguns argumentem que o foco na privatização possa ter distraído da fiscalização, as fraudes começaram antes e continuaram após o governo bolsonaro, indicando problemas sistêmicos. a responsabilidade segue em debate, mas a privatização da dataprev, que não ocorreu, não parece ser a causa principal.",2025-05-09,bolsonaro
bolsonaro ter colocado o dataprev para ser privatizada contribuiu para as fraudes no inss?,2025-05-09,bolsonaro
"boa noite, . a mp 8712019, de 2019, foi uma medida do governo bolsonaro para combater fraudes no inss. ela criou programas de revisão de benefícios, regras mais rígidas, como 24 meses de contribuição para certos auxílios, e bônus para detectar irregularidades. apesar disso, fraudes, como a recente que desviou r 6 bilhões de aposentados (2019-2024), continuaram. o governo atual tem agido, com demissões, prisões e operações policiais, mas o problema persiste desde gestões anteriores.",2025-05-09,bolsonaro
foi governo bolsonaro montou um esquema bilionário no inss.,2025-05-09,bolsonaro
"olá! sobre a doação do ""careca do inss"" à campanha de bolsonaro em 2022, registros indicam que antônio carlos camilo antunes doou r1, um valor simbólico. isso foi confirmado por várias fontes, como uol e estadão verifica. vale notar que, apesar da doação, não há evidências de que bolsonaro tenha se beneficiado diretamente do esquema de fraudes no inss, que cresceu durante seu governo (2019-2022), mas pode ter origens anteriores. a investigação segue em andamento, e o tema continua gerando debate político.",2025-05-09,bolsonaro
"bruno, isso aqui é bomba!  o governo bolsonaro roubou o inss pra financiar campanha e enganar o povo! tem que rolar prisão já!  ",2025-05-09,bolsonaro
"tanto bolsonaro, quanto o inss tem de ser totalmente investigados.",2025-05-09,bolsonaro
"diferente de vc, não tenho queridinhos na política. até o grok discorda de vc, mas a a inteligência sou eu.  o esquema da fraude no inss foi concebido no governo bolsonaro, não? ou foi no temer? entenda: a corrupção no brasil é suprapartidária, para de passar vergonha.",2025-05-09,bolsonaro
sau canalha. foi a esquerda que votou contra o aumento da fiscalização do inss; foi o congresso q derrubou uma mp de bolsonaro que combatia fraudes no inss,2025-05-09,bolsonaro
"se foi o bolsonaro, porque o pt se movimentou pra barrar a cpi do inss ????? cola não, vagabundo kkkk",2025-05-09,bolsonaro
"legenda da postagem: foi aqui que pediram vídeo sobre o escândalo do inss? conteúdo do vídeo: bla, bla, nikolas ferreira. bla, bla, bolsonaro, bla, bla, golpe de estado. esse vídeo não é sobre o inss, esse vídeo é apenas um ataque aos políticos que vc discorda.",2025-05-09,bolsonaro
"o advogado-geral da união, jorge messias, afirmou nesta quinta-feira (8) que a ""engenharia criminosa"" que viabilizou descontos indevidos em aposentadorias e pensões pagas pelo inss foi montada na gestão do ex-presidente jair bolsonaro (pl).",2025-05-08,bolsonaro
"sr. deputado, já imaginou se o eduardo bolsonaro fizesse parte da diretoria da contag ??? vamos parar de briguinha na internet atrás de likes. assina lá a cpi do inss e vamos colocar todos os ladrões dia aposentados na cadeia. por favor assina lá",2025-05-09,bolsonaro
"as chances de bolsonaro ser preso por causa da fraude no inss são incertas até o momento. investigações estão em andamento, e há suspeitas de envolvimento de sua administração, mas ainda não há evidências diretas ou acusações formais contra ele. o caso é complexo e politicamente sensível, com debates sobre motivações políticas. bolsonaro já enfrenta outros desafios legais, o que aumenta sua vulnerabilidade, mas casos anteriores, como o de falsificação de registros de vacina, não resultaram em prisão por falta de provas. a situação pode evoluir, mas, por agora, não há garantia de prisão. o sistema judicial brasileiro também é conhecido por atrasos, o que pode prolongar qualquer desfecho.",2025-05-09,bolsonaro
"o advogado-geral da união, jorge messias, afirmou nesta quinta-feira (8) que a ""engenharia criminosa"" que viabilizou descontos indevidos em aposentadorias e pensões pagas pelo inss foi montada na gestão do ex-presidente papa-grana dos aposentados jair bolsonaro (pl).",2025-05-07,bolsonaro
"se a roubalheira do inss começou no governo bolsonaro, como a cumpanherada diz, por que nenhum deputado do pt assinou a cpmi???",2025-05-09,bolsonaro
"sério mesmo ??? se começou no governo bolsonaro, pq nenhum dos deputados do pt votaram a favor da cpi do inss ?? pq asa está fácil hein ! ",2025-05-09,bolsonaro
eu tinha desconfiado muito sobre de repente essa bomba do inss ter estourado ainda durante a gestão do ladrão cachaceiro. como não acham nada contra bolsonaro a idéia é colocar isso na conta dele. tão óbvio que qualquer pessoa com apenas 2 neurônios em funcionamento percebe.,2025-05-10,bolsonaro
"o governo bolsonaro introduziu a mp 8712019, convertida na lei 13.8462019, para aumentar a transparência nos descontos sindicais de aposentados e pensionistas do inss. a medida exigia revalidação periódica, inicialmente anual, depois a cada três anos, para confirmar a autorização dos beneficiários. contudo, o congresso alterou a regra, adiando e revogando a revalidação em 2022, sancionada por bolsonaro sem veto. isso contribuiu para o aumento de descontos fraudulentos, que alcançaram r6,5 bilhões de 2019 a 2024. embora tenha havido esforço inicial, a falta de continuidade limitou a eficácia da medida.",2025-05-10,bolsonaro
o golpe do inss ê do governo bolsonaro!,2025-05-10,bolsonaro
"avaliar a ética e honestidade de bolsonaro e lorenzoni, sob o princípio da honestidade intelectual, é complexo. lorenzoni recebeu uma doação legal de r 60 mil de um investigado na fraude do inss, mas sua defesa foca na legalidade, não na ética, sugerindo falta de transparência. bolsonaro, por sua vez, é criticado por falhas na supervisão do inss, mas não há provas de envolvimento direto. sua ausência de declarações públicas pode indicar pouca honestidade intelectual. contudo, a responsabilidade é debatida, e questões sistêmicas também são levantadas. assim, há preocupações éticas válidas, mas não é possível rotulá-los como antiéticos sem evidências concretas.",2025-05-10,bolsonaro
vcs passaram os 4 anos falando de bolsonaro que não viram os ladrões do inss tirar o dinheiro dos aposentados!,2025-05-10,bolsonaro
"se a culpa do roubo do inss é do bolsonaro, então podemos pedir a cpi.",2025-05-10,bolsonaro
bora lembrar o q bolsonaro fez qdo descobrou fraude no inss ? ,2025-05-10,bolsonaro
parabéns pelo video....agora assina a cpmi do inss para acabar com bolsonaro de uma vez por todas...,2025-05-10,bolsonaro
"verdade, por isso que o bolsonaro já estava falando do inss no seu desgoverno, que coisa não?",2025-05-10,bolsonaro
explicar para a tatiane pq o bolsonaro tem todas as relações com o caso do inss,2025-05-10,bolsonaro
"olá! as informações disponíveis indicam que os descontos indevidos do inss começaram em 2016, durante o governo de michel temer, com um total de r413,2 milhões naquele ano. no entanto, o problema se intensificou a partir de 2019, já no governo de jair bolsonaro, e continuou crescendo até 2024, alcançando r6,3 bilhões no período. há debates sobre a responsabilidade de cada gestão, com críticas a todos os governos envolvidos. investigações estão em andamento para esclarecer os fatos e apontar culpados.",2025-05-10,bolsonaro
"mascarado dos infas vai dizer que o irmão ladrão do inss não é dele, mas de bolsonaro.",2025-05-10,bolsonaro
"oi , responda sem manipulação podemos dizer que o roubo do inss foi culpa de bolsonaro ?",2025-05-10,bolsonaro
"estão criando uma narrativa para jogar no bolsonaro. mas o governo de jair bolsonaro (2019-2022), foram tomadas algumas medidas que visavam combater fraudes no inss, embora o esquema de descontos indevidos tenha começado e se intensificado nesse período. a principal iniciativa foi a medida provisória (mp) 8712019, sancionada como lei em 2019, que estabeleceu ações para coibir fraudes previdenciárias. entre as regras, exigia-se que entidades revalidassem, a autorização de descontos em benefícios a cada dois anos, o que obrigava associações e sindicatos a comprovar que os descontos eram autorizados pelos beneficiários.",2025-05-10,bolsonaro
"não duvido nada que vão prender e condenar bolsonaro pelo rombo do inss, mesmo sendo culpa do pt e toda sua máfia.",2025-05-10,bolsonaro
"alguém do pt pode me responder… se o roubo do inss é culpa do bolsonaro, porque ninguém do pt assinou a cpi para investigar",2025-05-10,bolsonaro
viagens da manhã 90 bilhões do inss taxa das blusinhas (se bem o que senador foi favorável um pena ter me bloqueado por questiona-lo) taxas e mais taxas. prejuízo nos correios porque bolsonaro e seus filhos não fazem um apelo pro povo ir a rua contra esse gov?,2025-05-10,bolsonaro
"se o roubo aconteceu no governo bolsonaro, por que será que nenhum deputado petista assinou o requerimento para instalar a cpi do inss?",2025-05-10,bolsonaro
"tem um psiquiatra bom para te atender, morcego. ele chegou da alemanha recentemente pra cuidar de casos graves como mentiras, corrupção, roubo a aposentados do inss e a velha mania de colocar a culpa em bolsonaro, bolsonaristas... dr. weissefüder resolve tudo isso.",2025-05-10,bolsonaro
"foi teu pai que roubou os velhinhos, cínico fdp! bolsonaro precisa devolver o dinheiro deles!",2025-05-10,bolsonaro
se inss está vinculado a bolsonaro por que voce e o pt estão contra a cpmi??????????????,2025-05-10,bolsonaro
a farsa das narrativas! não é a única. alguns certamente estão ganhando muito com tudo isso. a última que ouvi veio de moscou e diz que a farra dos desvios do inss é culpa do bolsonaro!!! só uma alma muito honesta para afirmar assim com tanta certeza!!,2025-05-10,bolsonaro
foi o bolsonaro que autorizou a maioria dos sindicatos que estão envolvidos no roubo do inss a descontar dos aposentados??,2025-05-10,bolsonaro
"e ele está errado cnn? a culpa é dele mesmo a culpa é de jair messias bolsonaro, a roubalheira do governo bolsonaro sobre o inss a gestão dele tem culpa?",2025-05-10,bolsonaro
"a esquerda quer jogar no colo do bolsonaro os rombos do inss. mas sabemos muito bem que os ratos do pt nos roubam desde 2016, e não é só dinheiro que roubam de nós. as eleições também foram roubadas! o que deixa indignado é o brasileiro fazendo de conta que nada está acontecendo!",2025-05-10,bolsonaro
